src_id,src_lang,tgt_lang
614,你做得对，有人嫉妒你。你做得错，有人嘲笑你。你做得少，有人鄙 视你。你做得多，有人责难你。你高高在上，有人说不接地气。你和蔼可 亲，有人说智商不够。你活着，他们说赶紧死。你死了，他们还要在墓碑 上端一脚。“负能量人”无处不在。对付他们最好的办法，就是：走好自 己的路，让别人说去！,"Ban lam duoc thi co nguoi ghen ti, ban lam sai thi co nguoi che cuoi, ban lam it thi c6 ke khinh, ban lam nhieu thi c6 the gay kh6 de va ban lanh lung thi nguoi ta n6i kiéu ngao chan khong cham dat. Ban than thien hoa dong cung c6 nguoi keu rang n  u g   n     s a mot phat vao bia mo ban. Nhung loai thira hoi d6 ? dau cung c6, cach tot nhat de d6i dey."
615,做一个坚强的人，坦然面对，勇敢体会酸甜苦辣各种滋味，忘记消逝 的人和事。不能拥有的，懂得放弃；不能碰触的，学会雪藏。与其沉溺过 往，不如沐浴晴朗，扔掉悲伤和孤寂，摆脱无助和漠然，不再害怕未知， 不必盲目迷茫。,"P             n n nghiém nhung thu vi, ngot bui dang cay cua cuoc doi, quén di nhurng viec va nhurng nguroi da bien mat. Nhtrng thu khong the co duoc thi nen biet cach tu b?, nhung thu khong the dong vao thi nen de cho n6 dong lanh. Thay bang viéc chim dam trong qua khu thi ban durt bo het noi buon va co don, su bat luc va lanh cam, khong con d6t"
616,与人说话的时候，要学会心平气和。即使有再大的怒气，也不要大喊 大叫，因为你的大声，除了扰乱自己的心神，并不能让事情变得更好。歇 斯底里的吼叫征服不了别人，却只会让你在疯狂中失去理,"Khi noi chuyen voi nguoi khac phai git tam trang binh tinh, cho du c6 turc den tam tri cua chinh minh ra khong the khien moi chuyen tot len duroc. Tieng gao thet tr tan day long khong the khien nguoi khac khuat phuc ma no chi khien ban mat di i tri trong luc dien khung ma thoi"
617,一件事，想通了是天堂，想不通就是地狱。既然活着，就要活好。有 些时候我们由于太小心眼儿，太在意身边的琐事而因小失大，得不偿失。 拿什么都当回事，别去钻牛角尖，别太要面子，别小心眼。不在意，就是 一种豁达、一种洒脱。,"Cung mot chuyen, nghi thong roi thila thien duong, nghi khong thong thi la dia nguc. Da song thi phai song cho tot. Co nhtrng luc chung ta qua nh? nhen, qua de y nhung chuyen lat vat xung quanh ma hai den chuyen lon. C6 khi cai duoc lai khong bang cai mat. Moi chuyen co the dem den phien nao hay khong la do ban nhin nhan va xir li n6 nhu the nao. Durng luc nao cung coi tat ca moi thr deu la chuyen lon, diung de tam vao chuyén vun vat va diung qua chu y den the dien. Khong de y, khong quan"
618,心小了，所有的小事就大了；心大了，所有的大事都小了。看淡世事 沧桑，内心安然无恙。,S   n  on x u a doi thi noi tam m6i binh yen duoc.
619,当你每天都独进晚餐，下雨了没人送伞，开心的事没人可以分享，难 过了没人可以倾诉，走在熙熙攘攘的人群中，看着来往的人群，没人在意 你的喜悲，你的情绪不能用语言说出来，把所有事都烂在心里，宁愿让自 己渐渐消失在深夜亮着着华丽街灯的街道上，这就是最深的孤独。,"Su co don sau sac nhat chinh la moi ngay ban deu dung bura toi mot minh, troi mua khong c6 ai dua 6, khong c6 ai de chia sé niem vui va cung chang c6 ai de tam su n6i buon. D6 la khi ban di trong dong nguoi tap nap, nguoi di ke lai nhurng khong ai quan tam ban buon hay vui, la nhung cam xuc ma ban khong the n6i bang loi, la khi ban chat chua tat ca moi chuyen chang lanh de ban than dan dan bien mat trong anh den duong sang roi moi dem."
620,不要过分在意一些人，过分在乎一些事，顺其自然，以最佳的心态 面对。每个人的性格中，都有某些无法让人接受的部分，再美好的人也一 样。所以不要苛求别人，不要埋怨自己。,Bunp ea uuu n oay uenu no nun yon y uaanuo Key op re io 4 ap enb guna c6 mot phan khong the cho nguoi khac tiep can duoc va ke ca nguoi hoan hao nhat s n a      a trach ban than.
621,人越是怕丢人，就越是在乎别人的看法。越是在乎别人的看法，就越 是会忽略自己的感受。越是忽略自己的感受，就越是像木偶一样拼命活给 别人看。最后，一步一步将真实的自我囚禁在了深深的黑暗里。,Bunp ea uayu n oau uenu no nun yon ya uaanyo Aeu op ie lon 4 ap enb gung mot phan khong the cho nguoi khac tiep can duoc ke ca nguoi hoan hao nhat cung
622,别人恭维你时，偷偷高兴一下就可以了，但不可当真，因为那十有八 九是哄你的；别人批评你时，稍稍不开心一下就可以了，但不可生气，因 为那十有八九是真的。,"dirng coi d6 la that boi tam, chin phan nhurng cau n6i d6 la de ninh ban. Khi nguoi khac phe binh ban chi nen buon mot chut thoi va cung dirng turc gian vi tam, chin phan nhung cau n6i d6 la that."
623,最先道的人最勇敢，最先原谅的人最坚强，最先释怀的人最幸福。,Nguoi xin l6i dau tien la nguoi dung cam nhat. Nguoi tha thu dau tien la nguoi kien cuong nhat. Nguoi tir bo dau tien la nguoi hanh phuc nhat
624,不要期待，不要假想，不要强求，顺其自然，如果注定，便一定会发 生。心安，便是活着的最美好状态。,"Ding cho doi, ding ao tuong, dirng cuong cau, hay de moi thur thuan theo tur nhien. Neu nhur moi chuyen da duroc troi dinh thi nhat dinh n6 se xay ra, trong long binh yen chinh la trang thai tot nhat cua cuoc song."
625,拥有好心情，才有更好的状态；控制好自己的心情，生活才会祥和。 心情，虽不是人生的全部，却能左右生活的全部。坏心情，贬低了自己的 形象，降低了自己的能力，搅乱了自己的思维，影响了自己的信心，心情 好，一切都好；心情差，一切都乱套。有时输了，不是输给他人，而是输 给了自己的心情。,"C6 duoc tam trang tot m6i c6 duoc tam thai t6t, khong che duoc cam xuc cua ban than thi cuoc song moi tot dep. Tam trang khong phai la tat ca cua cuoc doi nhung n6 lai co the anh huong den toan bo doi song cua chung ta. Tam trang khong t6t se ha thap hinh tuong nang lurc cua ban than, lam roi loan suy nghi, anh huong den sy tu tin cua ban than, tam trang tot thi moi thu deu t6t, tam trang toi thi moi thur roi tung ca len. Nhieu luc chung ta thua khong phai la thua nguoi khac ma la thua cam xuc cua ban than."
626,当你觉得处处不如人时，不要自卑，记得你只是平凡人。当别人忽 略你时，不要伤心，每个人都有自己的生活。当你看到别人在笑时，不要 以为世界上只有你一个人在伤心，其实别人只是比你会掩饰。当你很无助 时，必须振作起来，即使输掉了一切，也不要输掉微笑。,"Khi ban thay minh khong c6 diem nao bang nguoi khac thi durng tu ti. Hay nho rang ban chi la nguoi binh thurong thoi. Khi nguoi khac khong quan tam den ban thi cung ding buon vi ai cung c6 cuoc song rieng cua minh. Khi ban nhin thay nguoi khac cuoi dirng nghi rang tren doi nay chi c6 mot minh ban dau long. Thuc ra chi la nguoi khac biet che giau noi dau gi?i hon ban thoi, khi ban thay minh vo dung thi phai vurc day va cho du thua tat ca cung khong duoc mat di nu curoi."
627,人生聚散无常，起落不定。一份好心情，是人生唯一不能被剥夺的财 富。这个世界，该是你的跑也跑不了，不是你的急也急不来。得之坦然， 失之泰然，随性而往，随遇而安，一切随缘是最豁达而明智的人生态度。,
