src_id,src_lang,tgt_lang
1112,- 你会看到蒸汽从头发和夹板上冒出来——这是正常的现象。你的头发没有烧焦，出现蒸汽是因为防烫油少量蒸发。,- Hơi nước bốc ra từ tóc và máy duỗi tóc là bình thường. Đó chỉ là sản phẩm chống nhiệt bay hơi; không phải là tóc đang cháy.
1112,- 如果你看到大量蒸汽，或者闻到烧焦的味道，立即将烫发棒拿开。,"- Nếu thấy bốc hơi nhiều hoặc có mùi tóc cháy, bạn cần vuốt máy duỗi tóc nhanh hơn một chút."
1112,- 如果头发非常卷曲或毛躁，就先从头顶的头发开始，小段小段地夹，然后再慢慢烫完整缕头发。,"- Nếu tóc của bạn đặc biệt quăn hoặc xù, hãy bắt đầu bằng vài nhát vuốt ngắn bên trên trước khi chậm rãi vuốt máy duỗi tóc như đã mô tả."
1112,如果头发还是不直，就把头发分得再细一些，或者调高烫发棒的温度。,"Nếu vẫn không thẳng như ý, bạn nên kẹp ít tóc hơn hoặc tăng nhiệt độ của máy duỗi tóc."
1112,- 用低温反复夹烫比用高温一次性夹烫更伤头发。,- Vuốt nhiều lần với mức nhiệt thấp có thể gây hư tổn cho tóc hơn là chỉ vuốt một lần với mức nhiệt cao.
1112,烫发的顺序是从最底层开始，一直烫到最外面一层头发。,Kẹp từ lớp tóc dưới cùng lên lớp tóc bên trên.
1112,- 特别留意后脑勺的头发。,- Chú ý hơn đến phần tóc ngay phía sau đầu.
1112,- 把发油抹在头发上。你只需用到豌豆大小，或更少量的发油。,- Xoa một giọt dầu dưỡng tóc cỡ bằng hạt đậu hoặc nhỏ hơn.
1112,- 小卷发和波浪发都可以用直板烫发棒烫直。,- Cả tóc quăn và tóc gợn sóng đều có thể duỗi thẳng bằng máy duỗi tóc.
1112,- 如果你想烫刘海，就往相反的反向拉头发，这样可以从视觉上增加发量。,"- Nếu có tóc mái, bạn hãy duỗi phần mái theo chiều ngược lại để tạo độ phồng."
1112,- 发夹、发箍、发卡,"- Kẹp tóc, dây buộc tóc"
1112,- 发胶 （可选）,- Keo xịt tóc (tuỳ ý)
1113,- 如果这是你第一次制作不干胶贴纸，先尝试简单的图案。,"- Nếu bạn mới làm nhãn dán vinyl lần đầu, hãy thiết kế đơn giản."
1113,如果你电脑上没有Photoshop或者Illustrator，可选择免费的图形编辑软件，比如GIMP。,"Nếu không có Photoshop hay Illustrator, bạn có thể sử dụng phần mềm chỉnh sửa ảnh như GIMP."
1113,- 你所设计图形的分辨率不能小于300像素每英尺。,- Chọn độ phân giải thấp nhất là 300 ppi (pixel/inch) cho hình ảnh.
1113,如果你使用的软件不允许选择新文档的大小，就打开后对文档的大小进行编辑。,"Nếu phần mềm mà bạn đang sử dụng không cho phép chỉ định kích thước khi mở tài liệu mới, bạn có thể chỉnh sửa kích thước sau đó."
1113,在软件菜单栏中寻找尺寸选项即可。,Hãy tìm nút Size (Kích thước) trong thanh menu của phần mềm.
1113,2. 将设计好的图案粘贴到新文档中。,Dán thiết kế mà bạn đã tạo vào tài liệu mới.
1113,如果你想制作若干张同样图案的贴纸，就将图案多粘贴几次，然后进行排版。,"Nếu bạn muốn in nhiều nhãn dán trên cùng một trang, hãy dán thiết kế vào nhiều lần rồi căn chỉnh theo hàng."
1113,注意图案不能位于文档的边缘，否则打印出来后会不完整。[1] 研究来源,"Kiểm tra để chắc chắn rằng không có hình ảnh nào nằm ngoài lề của mẫu, nếu không chúng sẽ bị cắt mất khi in.[1] Nguồn nghiên cứu"
1113,如果有图案在模板边缘处被切断，就把它们移到远离边缘的位置。,"Nếu có bất kỳ bản sao nào của thiết kế bị cắt bởi lề, hãy dời chúng ra xa cạnh của mẫu."
1113,- 不干胶打印纸可以在网上购买，也可以在本地的办公用品商店买到。,- Bạn có thể mua giấy in vinyl trên mạng hoặc cửa hàng văn phòng phẩm tại địa phương.
1113,- 乙烯基不干胶适合在户外使用，因为它能抵抗不利天气因素的影响。,- Nhãn dán vinyl thích hợp sử dụng ngoài trời vì chất liệu này bền bỉ với các yếu tố môi trường.
1113,在图形编辑软件里找到打印选项，然后单击。,Tìm và nhấp vào nút in trên phần mềm chỉnh sửa ảnh.
1113,- 将打印机设置为高质量打印模式，这样打印出的贴纸才会好看。,- Đặt máy in về chế độ in chất lượng cao để nhãn dán đẹp nhất có thể.
1113,用手指按压塑封膜，使其粘在贴纸上。[3] 研究来源,Dùng ngón tay ấn lớp màng laminate xuống giấy in vinyl để dán.[3] Nguồn nghiên cứu
1113,1. 给不干胶打印纸贴膜。,1. Đặt màng laminate lên giấy in nhãn.
1113,- 塑封纸可以在网上购买，也可以在本地的办公用品店买到。,- Bạn có thể tìm mua màng laminate trên mạng hoặc cửa hàng văn phòng phẩm tại địa phương.
1113,如果图案是圆形的，用剪刀把贴纸剪下来，或者剪出正方形的背景。,"Nếu nhãn dán thiết kế hình tròn, bạn có thể dùng kéo để cắt theo hình tròn hoặc nền vuông."
1113,- 图形编辑软件（Krita 非常适合专业的艺术设计，但很多电脑在出厂时就已经安装了Paint或Gimp）。,"- Phần mềm chỉnh sửa ảnh (Krita rất thích hợp để thiết kế chuyên nghiệp, nhưng Paint hoặc Gimp thường được cài đặt sẵn trên máy tính)"
1113,- 与上述纸张兼容的喷墨打印机,- Máy in phun tương thích với loại giấy in trên
1113,- 剪刀或美工刀,- Kéo hoặc dao rọc giấy
1113,- 大号打印机,- Máy in lớn
1113,- Cricut这款程序非常适合用来设计乙烯基不干胶贴纸，但是你必须购买大号的切割机与之匹配。,"- Cricut là chương trình thích hợp để thiết kế nhãn vinyl, nhưng bạn phải mua máy cắt lớn."
1114,用第三方应用下载视频违反YouTube用户协议的条款，也可能违反版权法，所以这类应用大部分都会被App Store下架。,"Việc sử dụng ứng dụng bên thứ ba để tải video vi phạm điều khoản của thỏa thuận người dùng YouTube và ngoài ra còn vi phạm luật bản quyền, vì thế hầu hết ứng dụng có chức năng này đều bị xóa khỏi App Store."
1114,本文会教你下载YouTube视频到iPad，方便离线观看。,Bài viết này hướng dẫn bạn cách tải video YouTube để xem trên iPad.
1114,它位于屏幕右上角。,Nút nằm ở bên trái phía trên màn hình.
1115,拆除墙砖和拆除地板砖不同，难度更高，因为前者彼此之间往往更加紧密，砖缝很小。这意味着拆除墙砖时，如果不想损坏周围的瓷砖，就必须得更加小心。,"Để tháo gạch ốp tường, bạn phải áp dụng một kỹ thuật khác và khó hơn so với gạch lát nền vì gạch ốp tường được đặt rất sát nhau, với kích thước đường ron tối thiểu. Điều này có nghĩa bạn phải cẩn thận hơn khi muốn tháo gạch ốp tường mà không làm hỏng xung quanh."
1116,- 婴儿油,- Dầu thoa em bé
1116,- 按摩油,- Dầu mát –xa
1116,- 橄榄油,- Dầu ô liu
1116,- 菜籽油,- Dầu hạt cải
1116,- 融化的椰子油,- Dầu dừa lỏng
1116,- 油性乳液,- Lotion gốc dầu
1116,你也可以用棉垫、折叠的纸巾或干净的布料。,"Bạn cũng có thể dùng miếng bông gòn, tờ khăn giấy gấp lại hoặc mảnh vải sạch."
1116,把棉球泡到油里，直至浸透。,Nhúng viên bông gòn vào dầu cho đến khi bông ngấm đẫm dầu.
1116,3. 把棉球放到蜡上面，放30秒。确保蜡边缘的皮肤接触到油。,3. Áp miếng bông gòn lên vết sáp 30 giây. Đảm bảo xoa dầu xung quanh mép của vết sáp.
1116,如此一来，油才能渗入蜡和皮肤之间的空隙，让蜡松脱。轻轻挤压棉球，让里面的油流出来，把蜡完全浸透。,"Như vậy, dầu có thể len vào giữa vết sáp và da để làm bong sáp. Ép nhẹ lên bông gòn để dầu ngấm ra thấm đẫm vết sáp."
1116,- 如果蜡覆盖的区域较大，你可能得用纸巾吸油，然后把它们盖在蜡上面。轻轻把油挤出来，去除皮肤上的蜡。,"- Nếu vết sáp dính trên vùng da rộng, bạn có thể nhúng khăn giấy vào dầu và đắp lên vết sáp. Ép xuống để dầu ngấm ra."
1116,继续抹油并搓揉皮肤，直至所有蜡都被清除干净为止。,Tiếp tục xoa dầu và chà cho đến khi sạch sáp.
1116,- 如果蜡擦不掉，你可能得多用些油。,"- Nếu vết sáp khó cọ sạch, có lẽ bạn cần dùng thêm dầu."
1116,- 试着用毛巾擦掉剩余的蜡。,- Thử dùng vải thun da cá để chà sạch các mẩu sáp còn lại.
1116,用毛巾把皮肤拍干。,Thấm khô da bằng khăn khô.
1116,用肥皂和水把多余的油洗掉。,Dùng xà phòng và nước rửa sạch dầu.
1117,Torrent文件（BT种子文件）是一种很受欢迎的在线文件分享方式 。,Sử dụng Torrent là một trong những cách phổ biến nhất để chia sẻ tập tin trực tuyến.
1117,下载种子文件（Torrent）,Tải Torrent
1117,- uTorrent,- uTorrent
1117,- BitTorrent,- BitTorrent
1117,- Vuze,- Vuze
1117,2. 找到你想要下载的游戏的种子文件。,Tìm kiếm tập tin torrent của game mà bạn muốn tải về.
1117,- 尝试找到带多个“种子”的torrent文件。网络上有很多他人分享的种子文件，其中种子越多，连接到服务器的下载速度越快（最快可接近连接上限）。,"- Cố gắng tìm kiếm torrent có nhiều ""seeder"". Đây là những người đang chia sẻ tập tin, và càng kết nối với nhiều người thì tốc độ tải về càng nhanh chóng hơn (lên đến tốc độ kết nối cao nhất của bạn)."
1117,实际上，Torrent文件里不包含任何游戏数据。,Lý do là vì tập tin torrent không chứa bất cứ dữ liệu game nào.
1117,3. 下载torrent文件，并在客户端里打开它。,Tải và mở tập tin torrent bằng phần mềm.
1117,Torrent文件很小，可以在几秒钟内完成下载。,"Tập tin torrent có dung lượng rất nhỏ, thường thì sẽ được tải về chỉ trong vài giây."
1117,- 大部分torrent客户端被设置为自动打开.torrent文件。,- Hầu hết phần mềm torrent đều được thiết lập để tự động mở tập tin .torrent.
1117,- 点击此处了解如何下载torrent文件。,- Nhấp vào đây để biết cách tải tập tin torrent cụ thể.
1117,点击此处了解如何加速torrent下载。,Nhấp vào đây để biết cách tăng tốc torrent.
1117,4. 等待文件完成下载。,Chờ quá trình tải về hoàn tất.
1117,1. 下载并安装归档文件解压器（如果需要的话）。,Tải về và cài đặt trình giải nén (nếu cần).
1117,通过torrent文件下载下来的游戏文件多半是RAR（.rar）格式。这种归档文件需要特定的软件才能解压缩。,Nhiều torrent tải về có định dạng RAR (đuôi .rar). Đây là tập tin nén yêu cầu có phần mềm đặc biệt để giải nén.
1117,ISO文件是光盘的镜像文件，需要刻录或安装到电脑的虚拟盘里。,ISO là dạng tập tin ảnh của đĩa cần được ghi (burn) hoặc lắp (mount) trên máy tính bằng ổ ảo.
1117,EXE格式意味着你可以运行安装文件，并从安装器里安装所有东西。,"Nếu là định dạng EXE, bạn có thể chạy tập tin cài đặt và mọi thứ sẽ được cài đặt từ bộ cài."
1117,- 点击此处了解如何将ISO文件刻录到DVD。,- Hãy tự tìm hiểu cách ghi tập tin ISO vào DVD.
1117,- 点击此处了解如何将ISO文件安装到虚拟盘。,- Nhấp vào đây để biết cách lắp tập tin ISO vào ổ ảo.
1117,大部分torrent游戏都带有一个特定的安装说明文件（文本文件）。阅读这个说明文件是非常重要的，这是因为你需要完成一些特定的操作才能正确地安装游戏。,Hầu hết torrent game đều đi kèm với tập tin văn bản có hướng dẫn cài đặt chi tiết. Đây là thứ rất quan trọng cần phải đọc vì nhiều game yêu cầu thực hiện nhiều việc theo trình tự thì mới có thể cài đặt thành công.
1117,每个游戏的安装过程不尽相同，但是你通常需要运行EXE文件，或将ISO文件刻录、安装到虚拟盘，然后再运行光盘里的安装器。,"Chạy bộ cài. Bước này sẽ có khác biệt đáng kể tùy vào từng game, nhưng thường thì bạn cần chạy tập tin EXE hoặc lắp/ghi tập tin ISO và chạy bộ cài từ đĩa."
1117,大部分下载的游戏都受版权保护。为了绕过这项限制，你需要输入CD密钥或运行破解程序。,"Hầu hết game mà bạn tải về đều chống sao chép theo cách nào đó. Để tiếp tục, bạn cần nhập CD-key hoặc chạy phần mềm crack."
1117,大部分torrents文件包里都包含所需的破解程序，但是具体的操作方法却因游戏而异。,"Hầu hết torrent đều chứa phần mềm này cùng với các tập tin cài đặt, nhưng quá trình thực hiện sẽ khác biệt tùy theo từng game."
1117,- 有些游戏需要你用破解版本来替换安装文件夹里的EXE文件。,- Một số game yêu cầu bạn thay thế tập tin EXE bằng phiên bản crack trong thư mục game đã cài đặt.
1117,之后，当你想要玩游戏的时候，运行替换的EXE文件即可。,Bạn sẽ chạy tập tin EXE thay thế này mỗi khi muốn chơi game.
1117,- 有些游戏需要你运行一个密钥生成器，它会给你提供可用的CD密钥。,"- Đối với một số game, bạn phải chạy phần mềm tạo mã để có được CD-key."
1117,- 有些游戏有简单的EXE文件，你需要运行它来解锁游戏。,- Một vài game khác yêu cầu chạy tập tin EXE nào đó để mở khóa game.
1117,- 少数情况下，你需要编辑配置文件，运行游戏。,- Hiếm có trường hợp bạn phải chỉnh sửa tập tin tùy chỉnh để chơi game.
1117,6. 玩游戏。,Chơi game.
1117,第一次启动游戏时，你可能需要运行游戏的配置程序来设置图像选项。,Có thể bạn sẽ phải chạy chương trình tùy chỉnh game vào lần đầu thiết lập tùy chọn đồ họa.
1118,本文教你如何将iPad或安卓平板电脑连接到Windows或macOS电脑上。,wikiHow hôm nay sẽ hướng dẫn bạn cách kết nối iPad hoặc máy tính bảng Android với máy tính Windows hoặc macOS.
1118,1. 用USB数据线将平板电脑连接到电脑上。,Kết nối máy tính bảng với máy tính thông qua cáp USB.
1118,平板电脑上会出现一条通知。,Thông báo sẽ hiện lên trên màn hình máy tính bảng.
1118,使用平板电脑自带的充电线或兼容的充电线。,Sử dụng cáp sạc đi kèm với máy tính bảng hoặc cáp nào đó tương thích để kết nối.
1118,- 如果平板电脑带有驱动程序或软件，在继续操作之前先在电脑上安装它们。,"- Nếu máy tính bảng đi kèm với trình điều khiển (driver) hoặc phần mềm, bạn cần tiến hành cài đặt trước khi tiếp tục."
1118,- 安卓设备通常不需要安装特殊的驱动程序就能连接到Windows。,- Thường thì bạn không cần cài đặt trình điều khiển cụ thể để kết nối thiết bị Android với Windows.
1118,随后会出现一个连接选项列表。,Danh sách các tùy chọn kết nối sẽ hiện ra.
1118,2. 点击平板电脑上的通知。,Nhấn vào thông báo trên máy tính bảng.
1118,这样你就可以在电脑和平板电脑之间传输文件了。,"Như vậy, bạn sẽ có thể truyền tập tin giữa máy tính và máy tính bảng."
1118,3. 点击媒体设备。,Nhấn vào Media Device (Thiết bị đa phương tiện).
1118,4. 在电脑上按⊞ Win+E。,Nhấn ⊞ Win+E trên máy tính.
1118,将打开“文件资源管理器”。,File Explorer sẽ mở ra.
1118,连接电脑的驱动器和设备列表应该会出现在主面板中。,Danh sách các ổ đĩa và thiết bị kết nối với máy tính sẽ hiện ra trong khung chính.
1118,5. 点击此电脑。它在左侧栏中。,Nhấp vào This PC nằm trong cột bên trái.
1118,现在你可以在平板电脑上拖放文件，就像在其他硬盘上操作一样。,"Bây giờ, bạn có thể bắt đầu thao tác với các tập tin trong máy tính bảng như bất kỳ ổ đĩa nào."
1118,用数据线连接安卓平板电脑（Mac）,Kết nối máy tính bảng Android bằng cáp (trên Mac)
1118,//www.android.com/filetransfer。,//www.android.com/filetransfer bằng trình duyệt web.
1118,- 点击立即下载来下载文件。,- Nhấp vào DOWNLOAD NOW để tải tập tin xuống ngay.
1118,- 打开androidfiletransfer.dmg（你刚下载的文件）。,- Mở androidfiletransfer.dmg (tập tin mà bạn vừa tải xuống).
1118,- 将Android File Transfer拖到应用程序文件夹中。,- Kéo tập tin Android File Transfer và thả vào thư mục Applications.
1118,- 按照屏幕上的说明完成安装。,- Tiến hành theo hướng dẫn trên màn hình để hoàn tất quá trình cài đặt.
1118,2. 用USB数据线将平板电脑连接到电脑上。,Kết nối máy tính bảng với máy tính bằng cáp USB.
1118,使用平板电脑自带的充电线或兼容的充电线。,Sử dụng cáp sạc đi kèm với máy tính bảng hoặc cáp nào đó tương thích để kết nối.
1118,3. 在Mac上打开Android File Transfer。它在应用程序文件夹中。,Mở Android File Transfer trên máy Mac. Ứng dụng nằm trong thư mục Applications.
1118,将出现连接选项列表。,Danh sách tùy chọn kết nối sẽ hiện ra.
1118,4. 点击平板电脑上的通知。,Nhấn vào thông báo trên máy tính bảng.
1118,5. 点击媒体设备。,Nhấn vào Media Device.
1118,这样你就可以在电脑和平板电脑之间传输文件。,Vậy là bạn có thể bắt đầu truyền tập tin giữa máy tính và máy tính bảng.
1118,通过Wi-Fi（PC或Mac）连接安卓平板电脑,Kết nối máy tính bảng Android bằng Wi-Fi (PC hoặc Mac)
1118,方法如下：[2] 研究来源,[2] Nguồn nghiên cứu
1118,//www.ushareit.com/。,//www.ushareit.com/ bằng trình duyệt web.
1118,- 根据你的操作系统点击下载链接，下载应用程序。,- Nhấp vào liên kết tải xuống dành cho hệ điều hành cụ thể để tải ứng dụng.
1118,- 双击下载的文件（uShareIt_official.dmg for Mac，或SHAREit-KCWEB.exe for Windows）。,"- Nhấp đúp vào tập tin mà bạn vừa tải (uShareIt_official.dmg đối với Mac, hoặc SHAREit-KCWEB.exe dành cho Windows)."
1118,- 按照屏幕上的说明安装应用程序。,- Tiến hành theo hướng dẫn trên màn hình để cài đặt ứng dụng.
1118,3. 在搜索栏中输入shareit。,Nhập shareit vào thanh tìm kiếm.
1118,这样就会出现一个结果列表。,Danh sách kết quả sẽ hiện ra.
1118,4. 点击SHAREit – Transfer & Share。应用程序的蓝色图标包含3个点和3条曲线。,Nhấn vào SHAREit – Transfer & Share. Ứng dụng có màu xanh dương với biểu tượng ba dấu chấm và các đường cong.
1118,5. 点击安装。这样就可以在安卓上安装应用程序。,Nhấn vào Install (Cài đặt). Ứng dụng sẽ bắt đầu cài đặt trên thiết bị Android.
1118,6. 在电脑上打开SHAREit。它在Windows“开始”菜单的所有程序区域，或者macOS的应用程序文件夹中。,"Mở SHAREit trên máy tính. Ứng dụng nằm trong phần All Apps của trình đơn Start trên Windows, hoặc thư mục Applications đối với macOS."
1118,7. 在平板电脑上打开SHAREit。它是应用抽屉里的蓝白色图标（和Play Store上的一样）。,"Mở SHAREit trên máy tính bảng. Ứng dụng có biểu tượng màu xanh dương và trắng (tương tự như trên Play Store), bạn có thể tìm thấy trong app drawer."
1118,8. 在平板电脑上点击接收。,Nhấn vào Receive (Nhận) trên máy tính bảng.
1118,你现在就可以在电脑上使用SHAREit来浏览平板电脑上的文件了。,Bây giờ bạn có thể sử dụng SHAREit trên máy tính để duyệt tìm tập tin nằm trong máy tính bảng.
1118,9. 在安卓上点击连接PC。,Nhấn vào Connect PC (Kết nối PC) trên Android.
1118,用数据线连接iPad（PC或Mac）,Kết nối iPad bằng cáp (PC hoặc Mac)
1118,//www.apple.com/itunes/download 免费下载。,//www.apple.com/itunes/download.
1118,- 有关安装iTunes的帮助，请上网搜索。,- Xem thêm trên mạng để biết cách cài đặt iTunes.
1118,2. 用USB数据线将iPad连接到电脑上。,Kết nối iPad với máy tính bằng cáp USB.
1118,使用iPad自带的数据线或兼容的线。,Sử dụng cáp đi kèm với iPad hoặc cáp nào đó tương thích.
1118,这样就会自动启动iTunes，并在iPad上弹出消息。,"Sau khi bạn cắm cáp vào, iTunes sẽ tự động khởi chạy và bật lên thông báo trên màn hình iPad."
1118,- 如果iTunes没有自动启动，点击“程序坞”（macOS）中的音符图标，或者点击“开始”菜单（Windows）中所有程序区域中的iTunes。,"- Nếu iTunes không tự động khởi chạy, hãy nhấp vào biểu tượng nốt nhạc nằm trong thanh Dock (macOS), hoặc nhấp vào ứng dụng iTunes thuộc khu vực All Apps của trình đơn Start (Windows)."
1118,3. 在iPad上点击信任。,Nhấn vào Trust (Tin cậy) trên iPad.
1118,这样就允许iPad连接到电脑上。,Thao tác này nhằm cho phép iPad giao tiếp với máy tính.
1118,- 你可能需要在电脑上点击继续。,- Bạn cũng có thể nhấp vào Continue (Tiếp tục) trên máy tính.
1118,4. 点击iTunes中的iPad按钮。它是一个小图标，看起来像iPhone或iPad。它在iTunes的左上角附近。,Nhấp vào nút iPad trên iTunes. Đây là biểu tượng iPhone/iPad nhỏ nằm gần góc trên bên trái iTunes.
1118,iPad现在已经连接到电脑上了。,Vậy là iPad đã được kết nối với máy tính.
1118,使用蓝牙连接iPad（macOS）,Kết nối iPad bằng Bluetooth (macOS)
1118,3. 点击系统偏好设置。,Nhấp vào System Preferences (Tùy chỉnh hệ thống).
1118,4. 点击蓝牙。,Nhấp vào Bluetooth.
1118,它在窗口左侧。如果你看到的是“关闭蓝牙”，那么蓝牙就已经打开了，你应该可以在窗口右侧看到iPad名称。,"Nếu tiêu đề “Turn Bluetooth Off” (Tắt Bluetooth) đang hiển thị tại đây nghĩa là Bluetooth đã được bật, đồng thời tên iPad sẽ hiển thị ở bên phải cửa sổ."
1118,5. 点击打开蓝牙。,Nhấp vào Turn Bluetooth On (Bật Bluetooth).
1118,6. 点击iPad名称旁边的配对。,Nhấp vào Pair (Ghép đôi) cạnh tên iPad.
1118,它在窗口右侧。,Tùy chọn này nằm bên phải cửa sổ.
1118,7. 在iPad上点击配对。,Nhấn vào Pair (Ghép đôi) trên iPad.
1118,- Mac电脑可能会显示一段代码，你必须在iPad上输入才能完成配对。,"- Có thể Mac sẽ hiện ra một mã số, bạn cần nhập mã số này vào iPad để hoàn tất quá trình ghép đôi."
1118,9. 点击在设备上浏览文件…。,Nhấp vào Browse Files on Device… (Duyệt tìm tập tin trên thiết bị…).
1118,现在你可以用Mac来浏览和使用iPad上的文件了。,Bây giờ bạn có thể sử dụng Mac để duyệt tìm và sử dụng tập tin trên iPad.
1118,10. 选择你的iPad并点击浏览。,Chọn iPad rồi nhấp vào Browse (Duyệt tìm).
1119,使用蔬菜削皮器,Dùng Dụng cụ Gọt vỏ Rau củ
1119,1. 将胡萝卜放在凉水下冲洗。,Rửa cà rốt với nước lạnh.
1119,2. 在案台上放一个碗，用来盛放削下来的皮。,2. Đặt sẵn một chiếc bát trên quầy bếp. Bát sẽ dùng để hứng vỏ cà rốt được gọt ra.
1119,胡萝卜应该在碗的上方与其成45度角，尖的一头向下对着碗内。[2] 研究来源,Củ cà rốt phải nghiêng một gốc 45 độ so với bát với phần đầu nhọn hướng xuống dưới.[2] Nguồn nghiên cứu
1119,4. 将蔬菜削皮器抵住胡萝卜粗的一端。,4. Đặt dụng cụ gọt vỏ rau củ trên phần dày nhất của củ cà rốt.
1119,- 如果用砧板，你可以把胡萝卜尖的一头靠在砧板上。,"- Nếu dùng thớt, bạn hãy giữ cho đầu củ cà rốt dựng nghiêng trên thớt."
1119,9. 把胡萝卜放在砧板上，用削皮刀切掉两端。,9. Đặt củ cà rốt lên thớt và dùng dao cắt bỏ hai đầu.
1119,1. 将胡萝卜放在凉水下冲洗。,Rửa cà rốt với nước lạnh.
1119,2. 把胡萝卜尖的一头放在砧板上。,2. Đặt đầu củ cà rốt lên thớt.
1119,胡萝卜与砧板应该成大约45度角。,Thân củ cà rốt phải nghiêng 45 độ so với mặt thớt.
