src_id,src_lang,tgt_lang
1164,把运动衫放在干净的水槽里，打开热水，把衣服冲淋5到10分钟。接着，让运动衫的温度降到室温，检查尺寸是否有变化。[2] 研究来源,"Thử giặt áo nỉ bằng nước nóng. Để thực hiện phương pháp này, bạn sẽ cho áo nỉ vào một chiếc chậu sạch và xả nước nóng lên áo trong khoảng 5-10 phút, sau đó đợi áo nguội đi bằng với nhiệt độ phòng và kiểm tra lại kích cỡ.[2] Nguồn nghiên cứu"
1164,- 如果你还想继续缩运动衫的尺寸，可以尝试开水浸泡，热水洗涤或者高温烘干等方法。,"- Nếu muốn áo co vào thêm chút nữa, hãy dùng nước sôi, máy giặt và/hoặc máy sấy."
1164,开水能让衣服继续缩小。[3] 研究来源,Nước sôi sẽ khiến chiếc áo co lại nhiều hơn.[3] Nguồn nghiên cứu
1164,当水沸腾时，把衣服扔进锅里，盖上锅盖，再关火。,"Khi nước bắt đầu sôi, bạn sẽ cho áo vào nồi, đậy vung nồi và tắt bếp."
1164,- 如果你想让衣服的尺寸缩小一个码，就让衣服在开水里浸泡10到15分钟。,"- Nếu muốn áo co lại 1 cỡ, bạn cần ngâm áo trong nồi khoảng 10-15 phút."
1164,聚酯纤维不能被加热到81℃以上。,Vải polyester không nên tiếp xúc với nhiệt độ cao quá 81 ℃.
1164,- 这个方法不适合聚酯纤维面料的运动衫。,- Không áp dụng phương pháp này với áo nỉ làm từ vải polyester.
1165,虽然茶水不会让白色织物的颜色发生太明显的变化，但却可以隐藏浅色污渍，让织物看起来有古着感。最棒的是，只要会烧开水，你就能成功掌握这种染色法。,"Tuy rằng không thể đem lại màu sắc nổi bật cho vải trắng, nhưng màu trà sẽ giúp che lấp những vết ố nhạt màu và mang lại nét xưa cho món đồ vải. Điều hay nhất ở đây là bạn có thể nhuộm được bất cứ loại vải nào, miễn là có thể đun sôi nước."
1166,低温足够让你的苹果在几个星期内保持新鲜，但是如果你再采取一些其他的措施，苹果甚至能够冷藏几个月。,"Mặc dù chỉ cần nhiệt độ mát lạnh là đủ để giữ cho táo tươi trong nhiều tuần, nhưng chỉ cần cẩn thận hơn một chút, bạn có thể bảo quản táo đến vài tháng."
1166,苹果在长期储藏的过程中，为了保持新鲜，需要冷藏。,Táo cần nhiệt độ mát lạnh để giữ được độ tươi khi bảo quản trong thời gian dài.
1166,1. 选择形状好的苹果。[1] 研究来源 你要将那些有些坏掉或者某些部分发软的苹果挑出来，留下没有损坏的。,Chọn bảo quản những quả táo tươi ngon.[1] Nguồn nghiên cứu Kiểm tra số táo bạn đã chọn và tách những quả bị dập hoặc mềm ra khỏi những quả vẫn còn tươi ngon.
1166,时间不是很长，但是损坏的苹果应该在很短的时间内就要吃掉它，无论你用什么样的储存方式都不行。因为，苹果一旦有损坏部分，那它就会腐烂的更快。,"Tất nhiên đây chỉ là một khoảng thời gian ngắn, nhưng táo bị dập nên được ăn ngay bất kể bạn có bảo quản như thế nào, vì táo đã dập một phần sẽ bị thối nhanh hơn."
1166,现在的冰箱一般都会有一个水果抽屉或者保鲜盒，如果你的冰箱有这种储物层，你可以将你的苹果放在那里。,"Hầu hết các loại tủ lạnh hiện đại đều có ngăn bảo quản hoa quả hoặc ngăn mát; nếu tủ lạnh của bạn có loại ngăn này, hãy bảo quản táo ở đó."
1166,3. 将苹果放到冰箱里。[2] 研究来源 当苹果放在较低温度的地方，苹果就能够在较长时间内保持新鲜。,Xếp những quả táo tươi ngon vào tủ lạnh.[2] Nguồn nghiên cứu Táo sẽ vẫn tươi trong khoảng thời gian dài khi được bảo quản ở nhiệt độ lạnh.
1166,如果没有，你可以将苹果放在没有盖子的储存盒里，让储存盒放在靠近冰箱后面的地方，因为那里的温度最低。,"Nếu không có, bạn có thể cho táo vào hộp nhựa không đậy kín rồi đặt sát vào sâu bên trong tủ lạnh, nơi thường có nhiệt độ lạnh nhất."
1166,除了较低的温度外，苹果也需要适当的湿度来保持新鲜。,"Ngoài nhiệt độ lạnh, táo cũng cần thêm một ít độ ẩm để luôn tươi."
1166,5. 如果可以，请监视温度。,Theo dõi nhiệt độ khi có thể.
1166,如果你的冰箱有控温结构，你可以将温度设定在-1.1 到 1.7摄氏度。这是储存苹果的最佳温度范围。,"Nếu có hệ thống kiểm soát nhiệt độ cho ngăn mát, bạn nên điều chỉnh nhiệt độ ở khoảng -1°C đến 2°C. Đây là nhiệt độ lý tưởng để bảo quản táo."
1166,较低的温度会引起苹果的细胞被破坏，从而导致苹果变成糊状并不能食用。如果储存的温度调到12.2摄氏度又会引起苹果以两倍的速度加快成熟。,"Bảo quản táo trong điều kiện lạnh hơn sẽ khiến các tế bào bị vỡ, làm cho táo mềm nhũn, không thể ăn được; còn bảo quản táo trong điều kiện ấm hơn ở nhiệt độ 12°C có thể khiến táo chín nhanh hơn gấp đôi."
1166,[3] 研究来源 虽然挑选出来的苹果都是非常好的，但是它们还是会释放出一些乙烯气体。因此，包好每一个苹果，免得它们放在一起的时候会加速它们的成熟过程。,"Gói từng quả táo.[3] Nguồn nghiên cứu Kể cả táo còn tươi ngon cũng sinh ra một ít khí ethylene; do đó, những quả táo chạm vào nhau trong khi bảo quản thường bị hỏng nhanh hơn."
1166,单独包好每一个苹果能够防止它们在接触时腐坏。,Gói từng quả táo để ngăn nguy cơ bị hỏng do các quả táo chạm vào nhau.
1166,还有就是，如果一个苹果在储存的时候开始腐烂，那么它可能会糟蹋和它接触的所有苹果，这样就会导致整筐苹果被糟蹋。,"Bên cạnh đó, nếu một quả táo bị thối trong khi bảo quản, nó có thể lây sang những quả gần đó, khiến cho toàn bộ số táo đều hỏng nhanh hơn."
1166,选择仅有黑色墨汁的一面，因为有颜色的墨汁都含有有毒的重金属元素。,Chọn phần giấy chỉ có mực đen vì mực màu có chứa kim loại nặng độc hại.
1166,- 将一个苹果放在报纸的上面。,- Đặt một quả táo lên trên xấp giấy báo.
1166,- 继续包装每一个苹果，直到一筐苹果都包好。,- Tiếp tục gói từng quả táo bằng giấy báo đến khi hết số táo mà bạn có.
1166,3. 给纸板箱或木箱安衬里。[4] 研究来源 储存盒不能是密封的，因为不想在储存苹果的时候将它们隔离掉。但是你需要阻止大部分空气进入到储存盒里。,"Lót kín thùng gỗ thưa hoặc thùng các tông.[4] Nguồn nghiên cứu Thùng đựng táo không nhất thiết phải kín hoàn toàn, vì bạn vẫn cần để cho không khí lưu thông quanh táo trong khi bảo quản, nhưng nên hạn chế lượng không khí."
1166,5. 让苹果放在低温处。,Bảo quản táo ở nơi mát lạnh.
1166,6. 储存苹果的时候不能将它们靠近土豆。,6. Đừng bảo quản táo ở gần khoai tây.
1166,你可以将这两种产品放在同一储存地，但是不要让它们并排放。,"Bạn cũng có thể đặt hai loại nông sản này ở cùng một phòng hoặc nơi bảo quản, nhưng đừng đặt cạnh nhau."
1166,7. 在几个月之后查看你的苹果。,Kiểm tra táo sau vài tháng.
1166,按上述方法储存的话，苹果能够保持几个月的新鲜，但是几个月后，苹果就要开始变坏了。,"Bảo quản theo cách này, táo có thể giữ được độ tươi trong vài tháng, nhưng sẽ bắt đầu hỏng ngay sau đó."
1166,- 温度计,- Nhiệt kế
1166,- 木箱或者纸盒,- Thùng gỗ hoặc thùng các tông
1166,- 稻草或穿孔的塑料衬里,- Rơm hoặc miếng lót nhựa có lỗ nhỏ
1168,这里有一些教你如何去做的建议。,Sau đây là một vài lời khuyên.
1168,如果你以正确的方法去做，最后得到特定的某个人的电话号码不是件困难的事。,Rốt cuộc thì việc xin số điện thoại của ai đó không khó nếu bạn đi đúng hướng.
1169,五边形是有五条边的多边形。,Ngũ giác là một đa giác có năm cạnh thẳng.
1169,通常有两种方法来求解五边形的面积，具体选择哪种方法取决于已知的信息。,"Có hai cách phổ biến để tính diện tích ngũ giác đều, tùy vào những thông tin mà đề bài cho."
1169,这个方法适用于求五个内角大小完全相等的正五边形面积。,Phương pháp này áp dụng cho ngũ giác đều với năm cạnh bằng nhau.
1169,1. 从边长和边心距入手。,Bắt đầu với độ dài cạnh và đường trung đoạn.
1169,- 不要混淆边心距和半径的概念，半径是从中心到五边形边角（顶点），而边心距则是中心到五边形的边中点的距离。,"- Đừng nhầm lẫn đường trung đoạn với bán kính, đây là đường thẳng nối từ tâm đến một góc (hay đỉnh) thay vì trung điểm của cạnh."
1169,2. 将五边形分割成五个三角形。,Chia ngũ giác thành năm hình tam giác.
1169,（记住，三角形的高是从一个顶点向对边作垂线，形成一个直角）。计算三角形面积的公式是：面积S=½ x 底边长 x 高。,"chiều cao của hình tam giác là đoạn thẳng đi từ đỉnh xuống cạnh đối diện và tạo thành góc vuông.) Để tìm diện tích của một hình tam giác, bạn chỉ cần tính ½ x đáy x cao."
1169,- 在我们的示例中，三角形面积 = ½ x 3 x 2 = 3 单位面积。,"- Trong ví dụ 1, diện tích của hình tam giác = ½ x 3 x 2 = 3 đơn vị diện tích."
1169,我们将五边形等分为五个三角形，每个三角形面积相等，五边形的面积就是三角形的面积乘以5。,"Lấy diện tích của một hình tam giác nhân với 5. Vì chúng ta đã chia ngũ giác thành năm hình tam giác bằng nhau, nên để tính diện tích tổng, bạn chỉ cần lấy diện tích của một hình tam giác nhân với 5."
1169,- 在我们的例子中，A（五边形面积） = 5 x A（三角形面积）= 5 x 3 = 15 单位面积。,"- Ở ví dụ 1, diện tích của ngũ giác S = 5 x S(tam giác) = 5 x 3 = 15 đơn vị diện tích."
1169,这个方法适用于求五条边长完全相等的正五边形面积。,Phương pháp này áp dụng cho ngũ giác đều với năm cạnh bằng nhau.
1169,1. 仅从边长入手。,Bắt đầu chỉ với độ dài cạnh.
1169,2. 将五边形分割成五个三角形。,Chia ngũ giác thành năm hình tam giác.
1169,3. 将三角形分成两半。,Chia hình tam giác làm đôi.
1169,从五边形的中点向三角形底边作垂线，这条线和底边相交形成90º角，并将三角形分成两半，形成两个更小的三角形。,Vẽ đường thẳng từ tâm của hình ngũ giác đến đáy của hình tam giác. Đường thẳng này sẽ vuông góc với đáy và chia tam giác thành hai hình tam giác nhỏ hơn có cùng kích thước.
1169,在本例中，小三角形的底边为½ x 7 = 3.5 单位长。,"Trong ví dụ 2, ta có đáy của hình tam giác nhỏ = ½ x 7 = 3,5 đơn vị."
1169,- 三角形的底边 就是五边形边长的 ½ 。,- Đáy của tam giác nhỏ bằng ½ cạnh của ngũ giác.
1169,（具体计算过程是：中心是360º，我们将其分为10个相同的小三角形，也就是360 ÷ 10 = 36。,"360 ÷ 10 = 36. Vậy, góc nằm ở tâm hình ngũ giác của mỗi tam giác nhỏ là 36º.)"
1169,- 36º角的对边是三角形的底（五边形边长的一半）。,- Cạnh nằm đối diện góc 36º là đáy của tam giác nhỏ (½ cạnh hình ngũ giác).
1169,36º 角的临边是三角形的高。,Cạnh kề của góc 36º là chiều cao của tam giác nhỏ.
1169,- tan（36º） = 对边/ 临边,- tan(36º) = cạnh đối/ cạnh kề
1169,- 在本例中，tan（36º） = 3.5 / 高,"- Trong ví dụ 2, ta có tan(36º) = 3,5 / chiều cao tam giác nhỏ"
1169,- 高 x tan（36º） = 3.5,"- Chiều cao tam giác nhỏ x tan(36º) = 3,5"
1169,- 高= 3.5 / tan（36º）,"- Chiều cao tam giác nhỏ = 3,5 / tan(36º)"
1169,- 高= （约等于） 4.8 单位长。,"- Chiều cao tam giác nhỏ gần bằng 4,8 đơn vị."
1169,- 在本例中，小三角形的面积 = ½bh = ½（3.5）（4.8） = 8.4 单位面积。,"- Ở ví dụ 2, diện tích của tam giác nhỏ = ½bh = ½(3,5)(4,8) = 8,4 đơn vị diện tích."
1169,一个小三角形的面积是五边形面积的1/10。,Một hình tam giác nhỏ bằng 1/10 diện tích ngũ giác.
1169,所以，要求五边形面积，用小三角形面积乘以10即可。,"Vậy, để tính diện tích hình ngũ giác, bạn chỉ cần lấy diện tích tam giác nhỏ nhân với 10."
1169,- 在本例中，五边形面积 = 8.4 x 10 = 84 单位面积。,"- Trong ví dụ 2, diện tích của toàn bộ hình ngũ giác = 8,4 x 10 = 84 đơn vị diện tích."
1172,如果你用的是普通的打印纸，只需将顶上一角横着折下来，令侧边与纸的底边对齐，长方形的长边会长出一段。,"Gấp giấy sao cho mặt màu hướng ra ngoài. Nếu bạn dùng một tờ giấy in thông thường, chỉ cần gấp một góc tờ giấy sao cho góc này trùng với cạnh dưới của giấy, chừa ra một phần giấy hình chữ nhật."
1175,- 帮助你把握论文结构和文字组织。,- Giúp bạn hiểu được cấu trúc và tổ chức của đề bài
1175,- 培养你判断决定的能力。,- Tăng cường khả năng tự ra quyết định của bạn
1175,- 推荐一些有用的参考资料。,- Giới thiệu cho bạn tham khảo các nguồn lực quan trọng và tài liệu hữu ích
1175,- 教授，讲师或其他教职人员,"- Giáo sư, người hướng dẫn và những thầy cô khác"
1175,- 兄弟姐妹或其他家庭成员,- Anh chị em hoặc người thân trong gia đình
1175,- 教练或者助理教练,- Huấn luyện viên và trợ lý
1175,- 职业运动员或已退役的运动员,- Những cầu thủ chuyên nghiệp hoặc cầu thủ đã nghỉ hưu
1175,- 训练员,- Người huấn luyện
1177,清洗床单和其他寝具并不困难，但清除床垫上呕吐物的气味和污渍，就没有那么容易了。关键在于要快速行动，但使用小苏打、醋和医用酒精等清洗剂也很重要，它们可以中和气味，消灭可能会在床垫上滋生的病菌。,"Giặt ga và đồ vải trên giường thì tương đối dễ, nhưng việc khử mùi và vết bẩn trên nệm có thể là một thách thức. Điều then chốt là hành động nhanh, nhưng còn một điều quan trọng nữa là dùng các chất tẩy rửa như muối nở, giấm và cồn để khử mùi và diệt vi khuẩn có thể còn bám trên nệm."
1177,清除呕吐物,Dọn dẹp bãi nôn
1177,清洁床垫的第一步是清除床表面的呕吐物。,Dọn sạch bãi nôn trên giường. Bước đầu tiên là dọn bãi nôn trên bề mặt giường.
1177,用纸盘把床上的所有固体呕吐物刮到塑料袋里，然后扔进垃圾桶。[1] 研究来源,Dùng đĩa giấy để xúc toàn bộ bãi nôn bỏ vào túi nilông và vứt vào thùng rác.[1] Nguồn nghiên cứu
1178,判断小狗年龄最简单的方法就是观察狗的牙齿，分析狗的行为，以及带狗去看兽医。,"Cách dễ nhất để xác định tuổi của chó con là xem xét răng, đánh giá hành vi và đem chúng đến bác sĩ thú y."
1178,检查狗的牙齿,Kiểm tra răng
1178,1. 看小狗是否长出牙齿。,Kiểm tra xem chú cún có răng không.
1178,这时的小狗可能眼睛还没张开，整天呆在狗妈妈身边。,Chó con chưa có răng là chó sơ sinh. Có thể chúng còn chưa mở mắt và chỉ ở bên cạnh chó mẹ suốt ngày đêm.
1178,犬牙是狗嘴里的四颗尖牙，两颗在上面，两颗在下面。,"Răng nanh là bốn chiếc răng nhọn của chó, với 2 chiếc ở hàm trên và 2 chiếc ở hàm dưới. Đây là những chiếc răng xuất hiện đầu tiên ở chó con."
1178,门牙是狗嘴前方犬牙之间的一组小牙齿。,"Răng cửa là những chiếc răng nhỏ phía trước miệng, giữa những chiếc răng nanh."
1178,犬牙长出后，接着长出的就是两组门牙了。门牙大概在小狗4到5周大时开始长出。[3] 研究来源,"Chó con có 2 bộ răng cửa mọc tiếp sau răng nanh, xuất hiện vào khoảng 4-5 tuần tuổi.[3] Nguồn nghiên cứu"
1178,当小狗长到4到6周大时，头两组前臼齿就会从小狗嘴里冒出来。[4] 研究来源,"Trong khoảng từ 4 đến 6 tuần tuổi, chó con sẽ có hai bộ răng tiền hàm đầu tiên mọc lên.[4] Nguồn nghiên cứu"
1178,最后一组门牙会在狗狗5到6周大的时候开始生长，而最后4颗前臼齿则会在狗狗6到8 周大时冒出来。,"Các bộ răng này mọc ra sau các bộ răng mọc trước đó vài tuần. Những chiếc răng cửa cuối cùng sẽ mọc khi chó con được từ 5 đến 6 tuần tuổi, và 4 chiếc răng tiền hàm cuối cùng sẽ xuất hiện trong khoảng 6 đến 8 tuần tuổi.[5] Nguồn nghiên cứu"
1178,5. 观察最后一组门牙和前臼齿。,Tìm những bộ răng cửa và răng tiền hàm cuối cùng.
1178,当小狗长到8到16周大时，它们的头和下颌也会长大，导致牙齿之间的距离变宽。,"Trong thời gian tăng trưởng từ 8 đến 16 tuần tuổi, đầu và hàm của chó con sẽ tăng kích thước khiến cho răng của chúng thưa hơn."
1178,- 当狗狗长到5个月大时所有乳牙就差不多掉光了，而恒牙会在8到12个月之间全部长出。,"- Hầu hết răng sữa sẽ rụng khi chó con được 5 tháng tuổi, và răng vĩnh viễn sẽ xuất hiện trong khoảng từ 8 đến 12 tháng tuổi."
1178,检查小狗的身体和行为,Xem xét cơ thể và hành vi của chó con
1178,2周大的狗狗还很小，眼睛还没睁开。,Chó con dưới 2 tuần tuổi có kích thước rất nhỏ và còn chưa mở mắt.
1178,出生2到3周后，小狗的眼睛就会睁开了。,Chó con mở mắt khi được khoảng 2-3 tuần tuổi.
1178,它们似乎越来越熟悉周围的环境，并开始独自探索。上述是5到6周大的小狗具有的特点。[9] 研究来源,Chó con cũng có vẻ chú ý hơn đến mọi thứ xung quanh và bắt đầu tự đi khám phá. Đây là đặc tính của chó con trong giai đoạn từ 5 đến 6 tuần tuổi.[9] Nguồn nghiên cứu
1178,当小狗长到6到8周大时就会开始吃固体食物，并且变得独立，不再粘着狗妈妈。[10] 研究来源,Những chú chó con đang chuyển sang thức ăn rắn và bắt đầu sống độc lập với mẹ có lẽ là đã được 6-8 tuần tuổi.[10] Nguồn nghiên cứu
1178,3. 观察小狗是否开始吃固体食物。,3. Để ý xem chú cún của bạn đã ăn thức ăn rắn chưa.
1178,它们还会对周边的事物表现出极大的好奇心，喜欢玩耍，总是充满活力。[11] 研究来源,Chúng cũng bắt đầu chơi đùa không biết mệt và tò mò khám phá mọi thứ xung quanh.[11] Nguồn nghiên cứu
1178,小狗越大就越好动。8周大时，小狗的行为方式和人们印象中的狗基本上差不多了。,"Càng lớn, chó con sẽ càng hiếu động hơn. Đến 8 tuần tuổi, chú cún của bạn sẽ hành xử nhắng nhít đúng kiểu chó con mà ai cũng biết."
1178,5. 监督小狗的成长。,Theo dõi sự tăng trưởng của chó con.
1178,小狗在8到16周时会经历一次发育的黄金期，在接下来的几个月里，狗狗也会明显长大。[12] 研究来源,"Chó con sẽ lớn vọt lên trong giai đoạn từ 8 tuần đến 16 tuần tuổi, và chúng tiếp tục lớn lên trông thấy trong vài tháng tiếp theo.[12] Nguồn nghiên cứu"
1178,小狗的毛非常软，而狗成年后，毛会变得更浓密，更厚实。,"Lông tơ của chó con rất mềm mịn, còn lông trưởng thành cứng cáp hơn và dày hơn."
1178,6. 观察狗毛的变化。,Theo dõi sự thay đổi ở bộ lông.
1178,6到12个月大的小狗会开始调皮捣蛋，测试主人的耐心。,Chó con từ 6 đến 12 tháng tuổi sẽ bắt đầu thử vượt khỏi ranh giới.
1178,大多数狗在8到12个月时体型已经不会再变大了。,Hầu hết chó con sẽ đạt đến kích thước tối đa khi đến giai đoạn 8-12 tháng tuổi.
1178,有些品种的狗本来就很大，所以它们的身体还会继续发育，直到满2岁。,Các giống chó to sẽ tiếp tục lớn cho đến khi được 2 tuổi.
1178,两岁以下的狗仍然可算作“青少年”。,Một chú cún chưa đến 2 tuổi được coi là vẫn còn trong tuổi thiếu niên.
1178,没做过绝育手术的小母狗第一次发情通常在6到24个月大的时候。,Chó cái chưa triệt sản thường động dục lần đầu khi được 6-24 tháng tuổi.
1178,你还会发现母狗阴部开始肿胀，从阴道中分泌出带血丝或稻草色的液体。[15] 研究来源,"Ngoài ra, có bạn sẽ thấy bộ phận sinh dục của chó cái cũng sưng lên hoặc tiết dịch có màu như máu hoặc rơm.[15] Nguồn nghiên cứu"
1178,11. 带小狗去看兽医。,11. Đem chó con đến bác sĩ thú y.
1178,兽医会检查狗的体型、品种和牙齿，然后准确地估计出狗的年龄。,"Bác sĩ thú y sẽ xem xét kích thước và giống chó, quan sát răng chó và cho bạn biết tuổi ước tính khá chính xác của nó."
1178,如果你无法根据狗的牙齿，行为或生殖器的发育情况判断它的年龄，还是带它去看兽医吧。,"Nếu không đoán được chú cún của mình bao nhiêu tuổi dựa vào răng và các giai đoạn tăng trưởng, bạn có thể đem nó đến bác sĩ thú y."
1178,第一次体检时，兽医就会告诉你狗的年龄。,Bác sĩ thú y có thể cho bạn biết tuổi của nó trong lần khám đầu tiên.
1179,虽然烫坏头发让人沮丧，有时还会引起头皮或头发受损，[1] 研究来源 但你还是可以通过专业或自然的方法挽救失败的造型。,"Bất kể bạn tự uốn tóc, đến tiệm hay nhờ một người bạn hỗ trợ, mái tóc uốn không như ý có thể khiến bạn đau đầu. Mặc dù mái tóc xoăn “thảm họa” khiến bạn mất vui, và trong một số trường hợp còn gây hư tổn tóc lẫn da đầu,[1] Nguồn nghiên cứu nhưng bạn vẫn có thể áp dụng nhiều giải pháp chuyên nghiệp và tự nhiên để xử lý “thảm họa” đó."
1179,如果你想让头发变直，以便于重新造型，那么再次加热前，你一定要先深层滋润头发。,"Nếu bạn muốn tạo kiểu mới cho mái tóc uốn bằng việc làm thẳng tóc, dưỡng ẩm sâu cho tóc trước khi xử lý tóc bằng nhiệt là việc hết sức quan trọng."
1179,其实每天你都应该在头发上涂抹护发素，为头发补水，再次关闭头发上所有重要的角质层。[3] 研究来源,Bạn cũng nên dùng sản phẩm dưỡng tóc mỗi ngày để khôi phục độ ẩm và làm cho lớp biểu bì thiết yếu của tóc khép lại.[3] Nguồn nghiên cứu
1179,- 把头发打湿，然后用毛巾擦干。,- Làm ướt tóc và dùng khăn lau khô.
1179,这一步应该在水槽或浴缸上方完成。,Bạn nên thực hiện việc này tại bồn tắm hoặc bồn rửa tay.
1179,- 继续将涂抹了冷烫乳的头发梳10分钟。,- Tiếp tục chải tóc đã được thoa thuốc trong khoảng 10 phút.
1179,- 冲完后，用毛巾轻轻地把头发里的水吸干。不要用力摩擦，那样会让头发变毛躁。,"- Sau khi xả tóc, bạn sẽ dùng khăn nhẹ nhàng thấm khô nước trên tóc, tránh dùng khăn chà mạnh vì việc này khiến tóc rối hơn."
1179,- 用温水洗去中和剂。洗发时间也在5分钟左右。,- Xả tóc bằng nước ấm trong khoảng 5 phút để làm sạch thuốc dập.
1179,你可以让头发自然风干，或者用带扩散风嘴的热风机，选择最低的温度把头发吹干。,Hong khô tóc tự nhiên hoặc sử dụng máy sấy có đầu tản nhiệt và được đặt ở mức nhiệt thấp nhất. Dùng lược sấy để tạo nếp tóc và làm mượt tóc.
1179,- 用干毛巾轻轻吸掉头发里多余的水，注意不要摩擦头发。,- Sử dụng khăn sạch nhẹ nhàng thấm khô nước trên tóc thay vì chà mạnh.
1179,- 把头发伸到垃圾桶、水槽或浴缸上方，然后将足量菜籽油挤到头发上，让头发从发根到发梢都浸在油里。,"- Cúi đầu trên chậu, bồn rửa tay hoặc bồn tắm, và dùng lượng dầu hạt cải vừa đủ để thoa đều từ chân tóc đến ngọn tóc."
