src_id,src_lang,tgt_lang
1061,对MAC地址进行变更可以帮助你诊断网络问题，也可以只是给它取一个有趣的名字博人一笑。也许在某个时刻，你就会萌生出变更网络适配器的MAC地址的想法。那么不要错过这篇文章，我们将向您介绍如何在Windows中变更MAC地址。,Việc thay đổi địa chỉ MAC giúp bạn chẩn đoán các vấn đề mạng hoặc thay đổi tên. Đọc Bước 1 bên dưới để tìm hiểu cách thay đổi địa chỉ MAC trên Windows.
1061,使用设备管理器,Sử dụng Device Manager (Trình quản lý Thiết bị)
1061,你可以从控制面板中进入设备管理器。,Bạn có thể truy cập Device Manager từ Control Panel (Bảng Điều khiển).
1061,1. 打开设备管理器。,Mở Device Manager.
1061,2. 打开设备管理器，你将看到列有安装在电脑里的所有硬件的列表。,"Trong mục Device Manager, bạn sẽ thấy danh sách các phần cứng được cài đặt trên máy tính."
1061,点击网络适配器版块查看所有你已经安装的网络适配器。,Mở rộng mục Network Adapters để xem các bộ điều hợp mạng đã được cài đặt.
1061,- 如果你不确定你使用的是哪个适配器，那么查看本文开头来找到关于你设备的描述。,"- Nếu không dám chắc mình đang sử dụng bộ điều hợp nào, bạn hãy đọc Bước 1 ở đầu bài viết này để tìm phần Description (Miêu tả) của thiết bị."
1061,从菜单中点击属性来打开网络适配器的属性窗口。,Chọn Properties (Đặc tính) từ trình đơn để mở cửa sổ Properties của bộ điều hợp mạng.
1061,找到“网络地址”或“本地管理地址”条目。,"Tìm danh mục ""Network Address"" (Địa chỉ mạng) hoặc ""Locally Administered Address"" (Địa chỉ được quản lý cục bộ)."
1061,4. 点击高级选项卡。,Nhấp chuột vào tab Advanced (Nâng cao).
1061,点击单选按钮来启用“值”（Value）的输入框。,"Nhấp chuột vào nút radio để kích hoạt trường ""Value""."
1061,点击该条目，你将在右侧看到“值”（Value）的字样和输入框。,"Tô đậm và bạn sẽ thấy trường ""Value"" (Giá trị) bên phải."
1061,- 不是所有的适配器都可以通过以上方法进行变更。,- Không phải bộ điều hợp mạng nào cũng áp dụng được cách này.
1061,1B:4C:3D:6E:5F”，那么你需要输入“2A1B4C3D6E5F”。,"1B:4C:3D:6E:5F"", bạn chỉ cần nhập ""2A1B4C3D6E5F""."
1061,6. 重启你的计算机来启用变更。,Khởi động lại máy tính để kích hoạt thay đổi.
1061,在ThinkPad和VaiO上，如果你只是单纯地开关Wi-Fi连接是无法达到禁用、激活网卡的效果的。,"Nếu chỉ kéo thanh trượt Wi-Fi's On/Off (Bật/Tắt) tương tự như trênThinkPads và VaiOs, bạn sẽ không thể tắt/bật card một cách thỏa đáng."
1061,7. 检查更改是否生效。,Kiểm tra xem thay đổi đã có hiệu quả hay chưa.
1061,当你重启计算机后，打开命令终端，然后输入,"Sau khi khởi động lại máy tính, hãy mở Command Prompt và nhập lệnh"
1061,ipconfig /all就能看到适配器的物理地址。注意地址是否已经变更为你的新MAC地址。,ipconfig /allvà ghi lại Physical Address của bộ điều hợp. Đây chính là địa chỉ MAC mới.
1061,使用注册表编辑器,Sử dụng Registry Editor
1061,1. 找到网络适配器的ID信息。为了更简单地在Windows注册表中识别您的网络适配器，你需要通过命令提示符终端收集一些基本信息。,"Tìm thông tin ID của bộ điều hợp mạng. Để dễ dàng xác định được bộ điều hợp mạng trong Windows Registry, bạn phải thu thập thông tin cơ bản thông qua Command Prompt."
1061,你可以在同时按下Windows key键和R键打开运行框，然后输入“cmd”打开终端。,"Bạn có thể mở Command Prompt bằng cách nhập ""cmd"" vào hộp thoại Run (phím Windows + R)."
1061,ipconfig /all，然后按下Enter键。,ipconfig /allvà nhấn Enter.
1061,忽略未激活的设备（即断开连接的媒体）信息。,Bỏ qua thiết bị mạng không hoạt động (Media Disconnected - Phương tiện bị ngắt kết nối).
1061,记下激活的网络设备的描述和物理地址。,Ghi lại Description và Physical Address đối với thiết bị đang hoạt động.
1061,net config rdr，然后按下Enter键。,net config rdrvà nhấn Enter.
1061,记下位于物理地址旁边的“{}”里的GUID信息。,"Ghi lại GUID được hiển thị trong dấu ""{}"", bên cạnh Physical Address mà bạn vừa ghi ở bước trên."
1061,你可以按下Windows键和R键打开运行框，然后输入“regedit”来打开注册表编辑器。你可以在注册表编辑器中更改网卡设置。,"Bạn có thể mở Registry Editor từ hộp thoại Run (Windows key + R) và gõ ""regedit"". Đây là thao tác mở Registry Editor, cho phép bạn chỉnh sửa cài đặt card mạng."
1061,2. 打开注册表编辑器。,Mở Registry Editor.
1061,- 对注册表的错误修改操作可能会引起系统故障。,"- Nếu thay đổi registry không chính xác, hệ thống có thể gặp trục trặc."
1061,前往HKEY_LOCAL_MACHINE\SYSTEM\CurrentControlSet\Control\Class\{4D36E972-E325-11CE-BFC1-08002BE10318}路径。,Mở HKEY_LOCAL_MACHINE\SYSTEM\CurrentControlSet\Control\Class\{4D36E972-E325-11CE-BFC1-08002BE10318}.
1061,3. 进入注册表键。,3. Điều hướng tới registry key.
1061,打开每个文件，并将DriverDesc处的描述和第一步中设备信息进行比对。然后比对NetCfgInstanceID处的信息和第一步的GUID。,"Mở từng thư mục và so sánh trường DriverDesc với phần Description bạn ghi lại ở bước đầu tiên. Để chắc chắn, bạn hãy kiểm tra trường NetCfgInstanceID xem có khớp với GUID từ bước đầu không."
1061,列表会列出标有“0000”、“0001”等名称的文件夹。,"Bạn sẽ thấy một số thư mục tên ""0000"", ""0001"", v.v."
1061,例如，如果“0001”文件夹匹配你的设备，那么点击该文件夹。,"Ví dụ, nếu thư mục ""0001"" khớp với thiết bị, bạn nhấp chuột phải vào thư mục đó."
1061,选择新建→字符串值。然后命名新建的“网址”字符串。,"Chọn New (Mới) → String Value (Chuỗi giá trị). Đặt tên cho giá trị mới ""NetworkAddress""."
1061,5. 右键点击匹配你的设备的文件夹。,Nhấp chuột phải vào thư mục khớp với thiết bị.
1061,1B:4C:3D:6E:5F”，那么你需要输入“2A1B4C3D6E5F”。,"1B:4C:3D:6E:5F"", hãy nhập ""2A1B4C3D6E5F"".."
1061,- D2XXXXXXXXXX,- D2XXXXXXXXXX
1061,- D6XXXXXXXXXX,- D6XXXXXXXXXX
1061,- DAXXXXXXXXXX,- DAXXXXXXXXXX
1061,- DEXXXXXXXXXX,- DEXXXXXXXXXX
1061,8. 重启计算机来激活更改。,Khởi động lại máy tính để kích hoạt thay đổi.
1061,在ThinkPad和VaiO上，如果你只是单纯地开关Wi-Fi连接是无法达到禁用、激活网卡的效果的。,"Nếu chỉ trượt công tắc Wi-Fi's On/Off giống trên ThinkPads và VaiOs, bạn sẽ không thể tắt/bật card mạng."
1061,9. 检查更改是否生效。,Kiểm tra xem thay đổi đã được áp dụng chưa.
1061,当你重启计算机后，打开命令终端，然后输入,"Sau khi khởi động lại máy tính, bạn mở Command Prompt và nhập"
1061,ipconfig /all就能看到适配器的物理地址。检查地址是否已经变更为你的新MAC地址。[1] 研究来源,"ipconfig /all, sau đó ghi lại Physical Address của bộ điều hợp. Đây chính là địa chỉ MAC mới.[1] Nguồn nghiên cứu"
1062,也许是为了遮挡刺眼的阳光，也许是为了给最爱的球队加油打气，也许你只是想遮住乱糟糟的头发——不论佩戴棒球帽的理由如何，这种饰物总有变脏的一天。,"Dù bạn đội mũ lưỡi trai để mắt khỏi chói nắng, để cầu may mắn cho đội bóng yêu thích của mình hay chỉ đơn giản là để giấu đi những sợi tóc bướng bỉnh, đến một lúc nào đó có lẽ bạn cũng phải giặt mũ."
1062,不管棒球帽是棉布、毛线还是其它材质，大多数情况下，你只需要少量洗涤剂，一些水，以及一张布就能将棒球帽洗干净 。,"Dù làm bằng cotton, len hoặc bất cứ chất liệu nào khác, hầu hết mũ lưỡi trai đều có thể giặt sạch chỉ bằng một ít xà phòng, nước và khăn sạch."
1062,1. 准备好一个装有水的容器。,Chuẩn bị một vật chứa nước.
1062,如果帽子特别脏，就用温水洗，但是绝对不能用烫水，因为高温会让帽子受损。[1] 研究来源,"Tuyệt đối không dùng nước nóng, vì nước nóng có thể làm hỏng mũ.[1] Nguồn nghiên cứu"
1062,2. 在水里加入少量洗衣液。,Hòa một chút xà phòng vào nước.
1062,洗衣液不用很多，大概一汤匙就够了。洗衣液必须和水彻底融在一起。[2] 研究来源,Bạn không cần nhiều xà phòng – khoảng 1 thìa canh là đủ. Đảm bảo xà phòng phải hòa tan hoàn toàn trong nước.[2] Nguồn nghiên cứu
1062,把干净的棉签或者旧牙刷往洗衣液溶液里蘸一下，然后轻轻擦拭或刷洗弄脏的地方。[3] 研究来源,Dùng tăm bông hoặc bàn chải đánh răng cũ nhúng vào nước xà phòng đang dùng và nhẹ nhàng chà sạch.[3] Nguồn nghiên cứu
1062,帽子最好泡几个小时。,"Ngâm mũ một lúc, tốt nhất là vài tiếng đồng hồ."
1062,帽子浸泡完毕后，把桶或者水槽里的溶液倒光或排干。接着打开水龙头，用温水（不能是烫水）冲洗帽子。务必将所有的泡沫都冲掉。,Xả sạch bọt xà phòng. Đổ hết nước xà phòng sau khi ngâm mũ. Đặt mũ dưới vòi nước ấm (không nóng) để xả sạch bọt xà phòng.
1062,多余的水被毛巾吸走后，就把帽子放在一边晾干。[6] 研究来源,"Khi mũ đã khô bớt nước, bạn chỉ việc hong gió cho khô.[6] Nguồn nghiên cứu"
1062,- 不要把帽子放进烘干机，那样会让帽子受损。,- Không bỏ mũ vào máy sấy để tránh làm hỏng mũ.
1062,购买洗涤剂时，认准毛衣专用的标签，或者至少选择不会损坏毛织物的洗涤产品。[7] 研究来源,Bạn hãy tìm loại xà phòng có ghi là dành riêng cho len hoặc an toàn cho chất liệu len.[7] Nguồn nghiên cứu
1062,2. 将帽子浸泡几个小时。,Ngâm mũ vài tiếng.
1062,- 如果帽子特别脏，你可以先将帽子浸湿，然后用手或旧牙刷去掉明显的污渍。注意不能使劲揉搓或刷洗，否则会弄损坏毛线。,"- Nếu chiếc mũ quá bẩn, bạn có thể giặt chỗ bẩn trước bằng cách nhúng mũ vào nước và dùng tay hoặc bàn chải đánh răng cũ chà sạch. Đừng chà mạnh quá để tránh làm hỏng len."
1062,帽子浸泡完毕后倒掉桶里的脏水，或者将水池里的水排干。打开水龙头，用冷水冲掉帽子上的泡沫和残余的污垢。[9] 研究来源,Xả sạch mũ. Đổ hết nước trong xô hoặc tháo cạn nước trong bồn rửa sau khi ngâm mũ. Để mũ dưới vòi nước mát cho đến khi sạch bọt xà phòng và chất bẩn.[9] Nguồn nghiên cứu
1062,4. 把帽子放在圆形物体上晾干。,Phơi khô mũ trên bề mặt tròn.
1062,- 如果情况紧急，你甚至可以把帽子晾在圆形的咖啡罐上。,"- Nếu cần, bạn có thể phơi mũ lên hộp cà phê tròn cũng được."
1062,清洗老旧的帽子,Giặt mũ lưỡi trai cũ
1062,1. 清洗前，先测试帽子的色牢度。,Thử độ bền màu của mũ trước khi giặt.
1062,准备一张干净的软布或者一把旧牙刷。冷水和少量洗衣液充分混合后，用布或牙刷蘸取混合液，轻轻地擦拭或者刷掉局部的污渍。[12] 研究来源,"Thay vào đó, bạn nên dùng vải mềm hoặc bàn chải đánh răng cũ nhúng vào hỗn hợp nước mát và một ít xà phòng và nhẹ tay làm sạch những chỗ bẩn. [12] Nguồn nghiên cứu"
1062,老旧的棒球帽更容易洗坏，所以不要把整顶帽子浸到水里。,"Xử lý trước những chổ bẩn trên chiếc mũ cũ. Mũ cũ thường dễ hỏng hơn, vì vậy bạn không nên nhúng hẳn vào nước."
1062,- 污渍去掉以后，将布用干净水打湿，然后轻轻按压帽子，吸走洗涤剂。,"- Khi các vết cáu bẩn đã bong ra, bạn hãy nhúng mảnh vải vào nước mát sạch và chấm lên mũ để làm sạch xà phòng."
1062,- 如果不清楚帽子的材质，你可以查看帽檐内的标签。,"- Nếu không chắc mũ làm bằng chất liệu gì, bạn hãy tìm nhãn mác gắn bên trong vành mũ."
1064,Google Drive前称谷歌文档，现名谷歌云端硬盘，是谷歌公司推出的一项在线云存储服务，允许你在网络上使用自己的谷歌账户创建和存储文档。,"Google Drive (hay còn được biết đến là Google Docs) là ứng dụng cho phép bạn tạo và lưu trữ tài liệu trên Web bằng tài khoản Google. Trong Google Drive, bạn có thể tải và lưu trữ tài liệu trực tiếp từ ổ cứng của máy tính hoặc thiết bị."
1064,你也可以将文档设置为离线保存，这样就算设备没有连入网络，也能浏览文档。,Bạn có thể thiết lập để tài liệu khả dụng ngay cả khi thiết bị không kết nối với internet.
1064,使用谷歌账户，访问想要下载的文档。,Sử dụng tài khoản Google liên kết với tài liệu muốn tải.
1064,1. 登陆谷歌云端硬盘网站。,1. Đăng nhập website Google Drive.
1064,- 你可以下载自己创建的文档，也可以下载别人分享给你的文档。,- Bạn có thể tải tài liệu tự tạo hoặc được người khác chia sẻ.
1064,2. 右键点击文件，选择“下载”，将文件保存为Word文档。,"Nhấp chuột phải vào tập tin và chọn ""Download"" (Tải về) để lưu tập tin dưới dạng tài liệu Word."
1064,网站会立刻把文件转换成Word格式，并下载到“下载”文件夹。,Tập tin sẽ ngay lập tức được chuyển đổi và tải về dưới định dạng Word. Bạn có thể tìm tập tin trong thư mục Downloads.
1064,- 如果你想要将文件另存为其它格式，请查阅下一部分。,"- Nếu muốn lưu tập tin dưới định dạng khác, hãy tham khảo bước tiếp theo."
1064,- 如果使用谷歌文档网站，而不是谷歌云端硬盘网站，请查阅下一部分。,"- Nếu sử dụng website Google Docs thay vì Google Drive, hãy tham khảo bước tiếp theo."
1064,3. 打开你想要下载的文件。,Mở tập tin muốn tải về.
1064,如果你想要将文件另存为.pdf、.rtf、.txt或网页文件，需要先打开文档。,"Nếu muốn tải tập tin dưới định dạng .pdf, .rtf, .txt hoặc trang web, bạn cần mở tập tin."
1064,4. 点击“文件”，选择“下载为”。接着会打开格式选项列表。,"Nhấp chuột vào ""File"" (Tập tin) và chọn ""Download As"" (Tải dưới dạng). Đây là thao tác mở danh sách định dạng."
1064,5. 选择你想要的文件格式。,Chọn định dạng muốn lưu tài liệu.
1064,你可以下载自己创建的文档，也可以下载别人分享给你的文档。,Bạn có thể tải tài liệu tự tạo hoặc được người khác chia sẻ.
1064,1. 打开谷歌云端硬盘应用程序（仅限安卓设备）。,Mở ứng dụng Google Drive (chỉ dành cho Android).
1064,- 你无法在iOS设备上下载文件，但是可以离线保存文档。即使设备没有联网，一样能查看文档。,"- Bạn không thể tải tập tin trên Drive phiên bản iOS, nhưng có thể lưu lại để xem khi thiết bị không kết nối internet."
1064,2. 长按谷歌文档，选择“下载”，将PDF格式的文件下载下来。PDF格式是下载谷歌文档默认的文件格式。,"Nhấn và giữ Google Doc và chọn ""Download"" để tải tập tin dưới định dạng PDF. Đây là định dạng mặc định của Google Docs khi tải về."
1064,如果你想要下载Word版本的文档，需要先将文档导出为Word格式。,"Nếu muốn tải Google Doc dưới định dạng Word, bạn cần xuất tập tin thành tài liệu Word trước."
1064,3. 将谷歌文档导出为Word文档，并把.docx文件保存到设备上。,Xuất Google Doc thành định dạng Word để lưu tập tin .docx về thiết bị.
1064,- 点击右上角的“更多”按钮，选择“分享和导出”。,"- Nhấn nút More (Thêm) ở góc phía trên bên phải màn hình và chọn ""Share & export"" (Chia sẻ & Xuất)."
1064,- 选择“另存为Word（.docx）”。这会在谷歌硬盘中创建一个与原文件同名的Word文档，并自动打开它。,"- Chọn ""Save as Word (.docx)"" (Lưu dưới dạng Word). Đây là thao tác tạo tài liệu Word cùng tên với Google Doc trên ổ cứng, tài liệu sẽ được mở tự động."
1064,- 返回到文档列表，长按新建的.docx文件。,"- Quay lại danh sách tài liệu của Google Drive, nhấn và giữ tập tin .docx."
1064,- 选择“下载”，将.docx文件保存到设备的下载文件夹。,"- Chọn ""Download"" để lưu tập tin .docx về thư mục Downloads của thiết bị."
1065,支持者声称碱性水能促进新陈代谢，减少血液里的酸性物质，并帮助身体更快吸收营养以及其它好处。,"Những người ủng hộ dùng nước điện giải cho rằng nó có thể gia tăng trao đổi chất, giảm axít trong máu, giúp cơ thể hấp thu chất dinh dưỡng mau hơn và còn nhiều lợi ích khác."
1065,天然的水处于酸碱值里的7（中性），然而其含有的杂质让水的酸碱值倾向左边（酸性）。纯饮用水的理想酸碱值为8或9（弱碱），你可将水碱化达到此酸碱值。[1] 研究来源,"Trong tự nhiên, pH của nước thường là 7, nhưng do có tạp chất nên nước có tính axít hơn, tức là dưới 7. Độ pH lý tưởng của nước uống là 8 hay 9, bạn có thể thu được giá trị này thông qua việc kiềm hóa nước.[1] Nguồn nghiên cứu"
1065,碱化后，水的酸碱值应大约处于8或9。,"Sau khi kiềm hóa, nước phải có mức pH đâu đó trong khoảng 8 tới 9 như trên biểu đồ xác định."
1065,如果水的酸碱值大于7，那么它为碱性，而小于7的水为酸性。,"Nước có pH trên 7 là nước có tính bazơ, trong khi đó dưới 7 là mang tính axít."
1065,用力摇晃（如果你使用水瓶）或搅拌（如果你使用杯子）小苏打混合液，确保小苏打完全融入水里。[2] 研究来源,Lắc (nếu dùng bình) hay quấy (nếu dùng cốc) hỗn hợp đó thật mạnh để bột nở hòa tan hoàn toàn trong nước.[2] Nguồn nghiên cứu
1065,把600毫克小苏打添加到237毫升的水里。,"Thêm 600 mg muối nở vào một cốc nước có dung tích 0,2 lít."
1065,- 如果你正在进行低钠饮食计划，切勿把小苏打添加到水里，因为小苏打含有大量钠。,- Nếu bạn đang trong chế độ ăn ít natri thì không nên cho muối nở vào nước. Trong muối nở chứa rất nhiều natri.
1065,柠檬为阴离子，所以当你喝柠檬水时，身体会与柠檬的阴离子成分起化学反应，让柠檬水在消化过程中变成碱性。[3] 研究来源,"Chanh mang tính anion nên khi bạn uống nước chanh, cơ thể phản ứng với anion của chanh, từ đó làm kiềm hóa nước trong cơ thể trong quá trình tiêu hóa.[3] Nguồn nghiên cứu"
1065,2. 使用柠檬。,Dùng chanh.
1065,最好使用过滤后的水，然而如果你没有滤水器，也可使用自来水。,"Nước lọc là tốt nhất, nhưng nếu không có thì bạn có thể dùng nước máy."
1065,- 把柠檬切成八份，放入水里。,"- Cắt quả chanh thành tám phần. Cho các miếng chanh vào nước nhưng đừng vắt, chỉ đơn giản bỏ chúng vào bình nước."
1065,- 将水盖好，在室温下静置隔夜（8到12小时）。,- Đậy nắp bình và để qua đêm từ 8 tới 12 tiếng ở nhiệt độ phòng.
1065,- 如果你想要，也可在柠檬水里添加一汤匙的喜马拉雅粉红色海盐。此举能使碱性水矿物化。,"- Bạn có thể thêm một thìa canh muối biển vào nước nếu muốn, việc thêm muối có tác dụng khoáng hóa nước."
1065,根据瓶子上的指示决定你应将多少的调节剂放入水里。[4] 研究来源,Làm theo hướng dẫn cụ thể trên bình để biết bạn cần phải thêm bao nhiêu giọt vào nước.[4] Nguồn nghiên cứu
1065,- 要记住的是酸碱调节剂只能提高水的碱性，但无法滤出自来水里的氯或氟化物等物质。,"- Bạn nên nhớ dung dịch điều chỉnh pH có thể làm tăng tính kiềm của nước, nhưng nó không lọc bỏ các thứ khác như clo hay flo thường có trong nước máy."
1065,使用不同的过滤系统,Dùng Hệ thống Lọc
1065,1. 购买电解水机。,Mua máy ion hóa nước.
1065,- 切勿把弱酸性水倒掉。,- Không nên bỏ nước có tính axít.
1065,酸性水能杀灭多种细菌，你可用它清洗身体，消灭一些在皮肤滋生的细菌。,"Nước có tính axít có thể tiêu diệt nhiều loại vi khuẩn, do đó bạn có thể dùng để diệt khuẩn cho da."
1065,2. 购买电离滤水器。,Mua lọc nước ion hóa.
1065,- 你可以在家居用品店的厨房电器部门购买到这些过滤器。,- Bạn có thể tìm mua lọc nước ion hóa trong khu vực bán đồ dùng cho bếp tại các cửa hàng gia dụng.
1065,3. 购买反渗透滤水器。,Mua lọc nước thẩm thấu ngược.
1065,这种滤水器也被称为精密过滤器（hyperfilter），使用一种特别细的薄膜过滤水。,"Loại lọc này còn được biết đến là loại siêu lọc, nó sử dụng các tấm màng cực mịn để lọc nước."
1065,蒸馏水器能让水稍微呈碱性，然而想要真的碱化水则必须将酸碱值调节剂添加到刚净化的水里。,"Máy chưng cất nước có thể kiềm hóa nước uống phần nào, nhưng để thật sự có tính kiềm thì bạn phải thêm dung dịch điều chỉnh pH sau khi đã lọc sạch."
1065,- 市面上有各种不同售价和尺寸的蒸馏水器。,- Máy chưng cất nước có giá cả và kích thước khác nhau.
1065,你可在厨房电器部找到它们。,Bạn có thể tìm mua tại khu vực bán đồ gia dụng bếp.
1066,你可以在Windows电脑和Mac电脑上添加字体。,Bạn có thêm phông chữ trên cả máy tính Windows và Mac.
1066,这篇文章将教你如何为Adobe Illustrator程序安装字体。,"Trong bài viết này, wikiHow sẽ hướng dẫn bạn cách cài đặt phông chữ vào chương trình Adobe Illustrator trên máy tính."
1066,在Windows电脑上,Trên Windows
1066,1. 如果程序处于打开状态，先关闭Illustrator。,Tắt Illustrator nếu đang mở.
1066,如果还没有下载要安装的字体，请先找到并下载字体文件。[1] 研究来源,"Nếu chưa tải phông chữ muốn cài đặt, hãy tìm và tải về máy trước khi tiếp tục.[1] Nguồn nghiên cứu"
1066,- Illustrator的字体文件必须完整，意味着它们必须包含粗体、斜体和下划线等模板，以及大写和小写全字母字符。,"- Phông chữ cho Illustrator phải là phông chữ hoàn chỉnh, tức là có cả mẫu chữ in đậm, in nghiêng, gạch chân cho cả chữ thường và chữ hoa."
1066,- 你可以下载.OTF、.TFF、.PFP和.TTF格式。,"- Bạn có thể tải phông chữ dưới định dạng .OTF, .TFF, .PFP và .TTF."
1066,5. 前往字体的压缩文件夹（ZIP）。在“文件资源管理器”左边栏中点击字体压缩文件所在的文件夹（如：下载）。,Nhấp chuột vào thư mục chứa thư mục ZIP phông chữ (ví dụ thư mục Downloads) ở cột bên trái màn hình File Explorer.
1066,- 你可能需要在主窗口里打开其它文件夹才能找到ZIP文件夹。,- Bạn có thể mở thêm thư mục ở cửa sổ chính để tìm thư mục ZIP.
1066,6. 点击字体的ZIP文件夹。这样将选中该文件夹。,Nhấp chuột vào thư mục ZIP phông chữ. Đây là thao tác chọn thư mục.
1066,这个选项卡位于文件管理器窗口的顶部。点击之后，提取选项卡下方会出现一个工具栏。,Tab này nằm ở đầu cửa sổ File Manager (Quản lý tập tin). Đây là thao tác hiển thị thanh công cụ bên dưới tab Extract.
1066,8. 点击提取全部。,Nhấp chuột vào Extract all (Giải nén toàn bộ).
1066,它位于工具栏的右侧。,Nút này nằm ở bên phải thanh công cụ.
1066,10. 等待字体文件完成解压。,10. Đợi giải nén tập tin phông chữ.
1066,完成解压后，提取的字体文件夹将会打开，这时候你就可以安装和使用字体文件了。,"Sau khi hoàn thành, thư mục tập tin được giải nén sẽ mở ra, lúc này bạn có thể tương tác với tập tin phông chữ."
