src_id,src_lang,tgt_lang
1223,但是，如果使用过多的修容会使妆面看起来很脏。为了保持妆感自然，可以在小而蓬松的刷子上涂抹少量的修容膏，轻柔地沿前额和太阳穴、颧骨下方，以及脸部两侧的下颚以“3”或者“E”的形状均匀地涂抹开。[7] 研究来源,"Tuy nhiên, nếu bạn sử dụng quá nhiều, gương mặt của bạn rất dễ bị lem nhem. Để được tự nhiên, bạn chỉ nên dùng cọ nhỏ lông mềm chấm một chút phấn và đánh nhẹ dọc theo trán và thái dương, dưới hai gò má và dọc xương hàm với hình “số 3” hoặc “chữ E” để tạo độ sắc nét mềm mại.[7] Nguồn nghiên cứu"
1223,如果脸颊上腮红的位置太低，脸会看起来像垮下来，显得很严肃。,"Nếu bạn đánh má hồng ở vị trí quá thấp trên má, gương mặt bạn sẽ có vẻ nặng nề và trông như bị kéo xuống."
1223,- 一开始可以只用少量的腮红，如果觉得颜色不够再一点点慢慢加上。,"- Bắt đầu bằng một lượng nhỏ phấn má hồng, và chỉ dặm thêm nếu bạn cần thêm màu."
1223,- 一个斜角化妆刷可以帮助你在脸部正确的位置打上腮红。,- Cọ má hồng vát chéo sẽ giúp bạn đánh má hồng đúng vị trí.
1223,1. 轻柔地填补你的眉毛。颜色过深且厚重的眉妆看起来会很不自然。为了避免眉妆看起来过于奇怪，可以使用和眉毛颜色相同或者更浅一点的眉部产品。,"1. Điều chỉnh nhẹ chân mày. Đường kẻ đậm liền nét trên lông mày không bao giờ là đẹp. Để tránh cặp chân mày trông quá sắc, bạn cần dùng sản phẩm kẻ chân mày có cùng màu hoặc có tông màu nhạt hơn lông mày thật."
1223,画眉毛时不单单只是画一条线，而是使用一系列的小线条来构成柔和自然的眉妆。[9] 研究来源,"Thay vì vẽ chân mày liền một nét, bạn hãy vẽ một chuỗi các nét nhỏ để trông có vẻ mềm mại tự nhiên.[9] Nguồn nghiên cứu"
1223,- 用眉粉来填充眉毛通常可以画出最柔和自然的眉妆。,- Thông thường chân mày vẽ bằng phấn sẽ tạo nét tự nhiên và mềm mại nhất.
1223,可以在眼皮处点上少量的眼部打底膏，然后在涂上眼影前用手指轻轻抹匀。[10] 研究来源,Chấm một lượng nhỏ kem lót lên mí mắt và dùng ngón tay tán nhẹ trước khi đánh phấn mắt.[10] Nguồn nghiên cứu
1223,- 如果没有眼部打底膏，可以用遮瑕膏代替。就当作打底膏使用。,"- Nếu không có kem lót dành cho mắt, bạn có thể thay thế bằng kem che khuyết điểm và sử dụng như kem lót."
1223,相反地，在眼角处以45度的角度贴一块透明胶带或者捏住一张小纸片，沿着边缘来画眼线，每次都能画出完美的猫眼眼线。[11] 研究来源,"Thay vì thế, bạn hãy dán một miếng băng dính trong hoặc giữ một mảnh giấy ở góc 45 độ tại góc mắt, sau đó chỉ việc đồ theo để chuốt đường kẻ mắt mèo thật hoàn hảo.[11] Nguồn nghiên cứu"
1223,- 如果借助胶带来画眼线，可以在贴到眼角之前先贴在手背上，再撕下来，来回撕拉几次。,"- Nếu dùng băng dính, bạn nên dán lên mu bàn tay và bóc ra vài lần trước khi dán lên góc mắt."
1223,卷曲的睫毛可以增加眼睛的张开度，使眼睛看起来更大。,Làn mi cong có thể giúp đôi mắt mở to và trông có vẻ lớn hơn.
1223,保持这个动作几秒钟来固定住这种卷曲的状态。,Giữ khoảng vài giây để duy trì độ cong.
1223,- 如果你根本不习惯使用睫毛夹，可以不用睫毛夹来卷曲睫毛。,"- Nếu không quen dùng dụng cụ kẹp mi, bạn có thể uốn lông mi mà không cần đến nó."
1223,5. 在涂唇彩之前，先去除唇部角质并滋润双唇。,Tẩy da chết và dưỡng ẩm cho môi trước khi tô son.
1223,将1/2茶匙（2.5毫升）的橄榄油和1茶匙（4克）的糖混合在一起，在嘴唇上揉搓来去除角质。,"Trộn ½ thìa cà phê (2,5 ml) dầu ô liu với một thìa cà phê (4 g) đường, và chà lên môi để tẩy tế bào chết."
1223,然后用湿毛巾擦掉。,Dùng khăn ẩm lau sạch.
1223,- 你可以购买唇部磨砂膏，或者用家里的材料来制作唇部磨砂膏。,- Bạn có thể mua sản phẩm tẩy da chết cho môi hoặc tự pha chế bằng các nguyên liệu gia dụng.
1223,- 在涂哑光唇膏之前，去除唇部角质和滋润双唇尤为重要。,- Một điều đặc biệt quan trọng là bạn cần tẩy da chết và dưỡng ẩm môi trước khi thoa son lì.
1223,然而，即使唇线笔的颜色与唇膏颜色贴近，只沿着唇部线条画一圈还是经常会显得很突兀。为了防止在嘴唇周围形成暗环，可以在画好唇部廓形之后直接用唇线笔填补颜色。[14] 研究来源,"Tuy nhiên, cho dù màu chì kẻ môi giống với màu son thì đường viền môi cũng nổi rõ nếu bạn chỉ thoa son dọc theo đường kẻ môi. Để tránh đường viền đậm quanh môi, bạn hãy dùng chì kẻ môi tô cả bên trong môi sau khi kẻ viền môi.[14] Nguồn nghiên cứu"
1223,- 如果找不到和唇膏颜色相近的唇线笔，可以用接近自然唇色的裸色唇线笔来搭配。,"- Nếu không thể tim được chì kẻ môi có màu trùng với màu son, bạn có thể dùng chì kẻ môi màu nude hợp với màu môi tự nhiên của bạn."
1223,修正常见的化妆错误,Tránh các lỗi trang điểm thường gặp
1223,- 如果你化了防水眼妆或者是厚重的粉底，最好在洗脸之前，将特定的卸妆产品加入你的卸妆护肤流程中。,"- Nếu dùng mỹ phẩm trang điểm mắt chống thấm nước hoặc lớp nền dày, tốt nhất là bạn nên dùng sản phẩm tẩy trang trong quy trình chăm sóc da trước khi rửa mặt."
1223,- 始终在床头柜上放着卸妆湿巾。,- Để khăn giấy tẩy trang trên tủ đầu giường.
1223,浴室里通常有一面大镜子，所以它似乎是化妆和存放化妆品的理想场所。,Phòng tắm thường có gắn gương lớn nên có vẻ như là nơi lý tưởng để cất mỹ phẩm.
1223,因此，应该将化妆品存放在通风干燥地房间里，比如卧室。[16] 研究来源,"Thay vì thế, bạn nên cất mỹ phẩm ở nơi khô và mát trong nhà, chẳng hạn như phòng ngủ.[16] Nguồn nghiên cứu"
1223,然而，浴室里的热度和湿度，更不用说细菌，都会加快化妆品变质。,Tuy nhiên nhiệt độ và độ ẩm trong phòng tắm có thể làm hỏng mỹ phẩm rất nhanh – đó là chưa kể đến vi trùng.
1223,3. 定期清洗化妆刷。,Rửa cọ trang điểm thường xuyên.
1223,保持化妆刷的清洁可能是很痛苦的一件事情，然而，每次使用脏的化妆刷会导致污垢、油脂和细菌散布在脸上。,"Việc giữ sạch cọ trang điểm có thể khá phiền toái, nhưng cọ bẩn có thể đem bụi đất, dầu nhờn và vi khuẩn lên mặt bạn mỗi lần sử dụng."
1223,所以应该每周用化妆刷清洗液或者其他清洁剂深层清洁，并在每次使用前，用日常化妆刷清洁产品来清洗化妆刷。[17] 研究来源,"Bạn nên làm vệ sinh kỹ cọ trang điểm bằng dầu gội đầu hoặc sản phẩm làm sạch khác mỗi tuần một lần, và dùng nước rửa cọ trang điểm hàng ngày để rửa cọ nhanh trước mỗi lần sử dụng.[17] Nguồn nghiên cứu"
1223,- 你可以在美妆店购买化妆刷清洗液或者日常化妆刷清洁产品。不过，你也可以自己制作。,- Bạn có thể mua xà phòng chuyên rửa cọ và nước rửa cọ tại các cửa hàng mỹ phẩm hoặc có thể tự pha chế tại nhà.
1223,- 许多出名的化妆师，比如Bobbi Brown、Kevin Aucoin和Jemma Kidd都写过关于化妆的书籍。如果你想确保用正确的方式化妆，这些书将会对你有帮助。,"- Nhiều chuyên gia trang điểm cho người nổi tiếng như Bobbi Brown, Kevin Aucoin, và Jemma Kidd có viết sách dạy trang điểm, có thể hữu ích nếu bạn muốn đảm bảo trang điểm cho mình đúng cách."
1223,- 如果你不确定自己的化妆方式是否正确，可以在柜台咨询。,"- Nếu không chắc mình có trang điểm đúng hay không, bạn có thể nhờ chuyên viên trang điểm ở quầy mỹ phẩm tư vấn."
1223,化妆师不仅可以帮助你挑选适合肤质的化妆品和彩妆产品，还可以教你如何正确使用这些化妆品。,Họ không chỉ giúp bạn chọn mỹ phẩm phù hợp với loại da và màu da của bạn mà còn có thể hướng dẫn bạn trang điểm sao cho đúng.
1223,- 尽管一些化妆技巧可以保持你的皮肤健康，并且让你看上去更美，但你应当尽可能去尝试随心地化妆。,"- Tuy rằng một số kỹ thuật trang điểm nhất định có thể giúp bạn duy trì làn da khỏe mạnh và trông đẹp hơn, bạn cũng nên thoải mái thử nghiệm với các phong cách trang điểm."
1224,顽固的蜡渍可通过冷冻、融化或者从平坦表面上刮除进行去除。,"Bạn có thể lấy mảng sáp cứng đầu ra bằng cách đông lạnh, đun chảy, hoặc cạo ra khỏi bề mặt phẳng."
1224,当供奉在玻璃罐内的蜡烛燃尽时，可能会在玻璃的底部及侧面留下顽固难除的蜡。,Thắp nến trong lọ thủy tinh đôi khi có thể để lại những mảng sáp cứng dưới đáy và cạnh lọ khi nến đã cháy hết.
1224,1. 将玻璃罐或者玻璃块放入冰箱。,Cho lọ thủy tinh hoặc miếng thủy tinh vào ngăn đá tủ lạnh.
1224,蜡烛一旦冷却到了室温，就把玻璃放入冰箱。,"Khi nến đã nguội ở nhiệt độ phòng, bạn hãy cho vào ngăn đông lạnh."
1224,- 如果蜡烛在被放入冰箱的时候温度过高，玻璃就可能会因为温度转变过快而产生裂纹。在冷冻之前，请确保玻璃的温度已经达到可用手触碰的程度了。,"- Nếu bạn cho vào ngăn đông lạnh khi còn quá nóng, thủy tinh có thể sẽ bị vỡ do sự thay đổi nhiệt độ đột ngột. Đảm bảo thủy tinh đã nguội trước khi đem đông lạnh."
1224,蜡和玻璃在冷冻的时候，蜡会开始收缩，并从玻璃两侧分离，这能使蜡更容易被除去。[1] 研究来源,"Khi sáp và thủy tinh bắt đầu đông cứng, sáp sẽ bắt đầu co lại và bong ra khỏi cạnh thủy tinh, long ra và làm cho việc lấy sáp dễ dàng hơn.[1] Nguồn nghiên cứu"
1224,2. 蜡至少要在冰箱中放置一个小时，期间它会收缩。,2. Để sáp co lại trong ít nhất một giờ.
1224,3. 用餐刀将蜡从玻璃罐中刮除。,Dùng dao ăn lấy sáp ra khỏi lọ thủy tinh.
1224,1. 将水煮开。,1. Đun sôi nước.
1224,水不需要煮到翻滚的程度，温度只要足以将蜡融化即可。,"Nước không cần phải quá sôi, chỉ cần vừa đủ nóng để làm chảy sáp."
1224,烧一些热水，使水温达到你能承受的最高温度，然后，将罐子放在水槽底部用热水浸泡一会儿即可。,"Mở vòi nước nóng đến mức bạn chịu được, sau đó ngâm lọ vào bồn nước một lúc."
1224,- 或者，你也可以在做菜的时候把玻璃罐加热一下。,"- Ngoài ra, bạn có thể làm nóng lọ trong khi rửa chén."
1224,- 擦洗海绵或纸巾,- Bông gòn hoặc giẻ lau
1225,这样你就可以在任何电脑上共享这些文字，不管电脑是否安装了这种字体。,"Như vậy, bạn sẽ có thể chia sẻ văn bản trên bất kỳ máy tính nào cho dù máy tính đó có được cài đặt phông chữ trong bản phác thảo hay không."
1225,本文教你如何在Adobe Illustrator中创建线条和文字的轮廓。,wikiHow hôm nay sẽ hướng dẫn bạn cách tạo phác thảo quanh các đường thẳng (line) và văn bản trên Adobe Illustrator.
1225,在Adobe Illustrator中，工具栏位于左侧。,Thanh công cụ nằm bên trái Adobe Illustrator.
1225,1. 选择一个工具。,Chọn công cụ.
1225,使用直线段工具创建直线。,Sử dụng công cụ Line để tạo đường thẳng.
1225,你还可以使用形状工具来创建一个周围带有线条的形状。,"Bên cạnh đó, công cụ Shape cũng có thể giúp bạn tạo hình với đường thẳng bao quanh."
1225,使用“钢笔”、“铅笔”或“画笔”工具创建曲线。,"Nếu muốn tạo đường cong, bạn có thể sử dụng công cụ Pen, Pencil hoặc Brush."
1225,选择工具后，单击并拖动以创建线条或形状。,"Sau khi chọn công cụ, hãy nhấp và kéo chuột để tạo đường thẳng hoặc hình dạng."
1225,2. 创建一条线或一个形状。,Tạo đường thẳng hoặc hình dạng.
1225,然后从色板中选择一种颜色。,"Sau đó, chọn màu từ trong bảng."
1225,你还可以使用这个方框更改线条的颜色。,Bạn cũng có thể sử dụng ô này để đổi màu cho đường thẳng.
1225,- 要想在形状周围添加一条线，选择这个形状并点击左上角带有彩色方块的方框。,"- Để thêm đường thẳng quanh hình dạng, bạn cần chọn hình dạng rồi nhấp vào ô với hình vuông màu ở góc trên bên trái."
1225,使用这个工具在Adobe Illustrator中选择对象。,Công cụ này sẽ giúp bạn chọn đối tượng trên Adobe Illustrator.
1225,3. 点击选择工具。它是一个类似于黑色鼠标光标箭头的图标，位于工具栏顶部。,Nhấp vào công cụ Select (Chọn) với biểu tượng con trỏ chuột màu đen nằm đầu thanh công cụ.
1225,使用选择工具，单击线条或形状来选择它。,Sử dụng công cụ chọn và nhấp vào đường thẳng hoặc hình dạng để chọn.
1225,4. 选择要创建轮廓的线。,Chọn đường thẳng mà bạn muốn tạo phác thảo.
1225,- 使用“描边”旁边的第一个下拉菜单来选择线条粗细。,"- Sử dụng trình đơn thả xuống đầu tiên cạnh mục ""Stroke"" để chọn độ dày cho đường thẳng."
1225,你也可以在下拉菜单框中输入大小数值。,Bạn cũng có thể nhập kích thước điểm vào khung thả xuống.
1225,这个下拉菜单显示各种不同的宽度配置文件。,Trình đơn thả xuống này thể hiện những cấu hình độ dày biến đổi khác nhau.
1225,- 使用“描边”旁边的第二个下拉菜单来选择可变宽度配置文件。,"- Sử dụng trình đơn thả xuống thứ hai cạnh mục ""Stroke"" để chọn cấu hình độ dày biến đổi."
1225,- 使用“描边”旁边的第三个下拉菜单来选择画笔类型。,- Sử dụng trình đơn thả xuống thứ ba để chọn loại cọ vẽ.
1225,6. 选择线条或形状。,Chọn đường thẳng hoặc hình dạng.
1225,选好线条外观后，使用选择工具来选择线条或形状。,"Sau khi đã hài lòng, bạn có thể sử dụng công cụ Select để chọn đường thẳng hoặc hình dạng."
1225,- 在创建线条和形状的轮廓之前，最好将它复制并粘贴到画板的一侧。,"- Trước khi tạo phác thảo cho đường thẳng/hình dạng, bạn có thể sao chép và dán đối tượng này vào một bên của bản vẽ."
1225,7. 点击对象。,Nhấp vào Object (Đối tượng).
1225,它在屏幕顶部的菜单栏中。,Tùy chọn này nằm trong thanh trình đơn đầu màn hình.
1225,这样将在“对象”下面显示一个下拉菜单。,"Một trình đơn sẽ thả xuống bên dưới mục ""Object""."
1225,8. 选择路径。,Chọn Path (Đường dẫn).
1225,- 要在描边后调整线条颜色，单击左上角的实体方框，并从色板中选择一种颜色。,"- Để điều chỉnh màu sắc đường thẳng sau khi đối tượng được phác thảo, hãy nhấp vào ô vuông màu ở góc trên bên trái và chọn màu sắc từ trong bảng."
1225,- 创建好线条的轮廓后，你可以使用左上角的第二个颜色框在轮廓周围添加描边。,"- Sau khi tạo phác thảo cho đường thẳng, bạn có thể thêm đường bao quanh bản phác thảo bằng cách sử dụng ô màu thứ hai ở góc trên bên trái."
1225,1. 点击文字工具。它在工具栏左侧。,Nhấp vào tùy chọn Text (Văn bản) nằm trong thanh công cụ bên trái.
1225,它有一个类似“T”的图标。,"Tùy chọn này có biểu tượng chữ ""T""."
1225,要想添加文本框，单击并拖动来创建文本框。,"Nếu muốn thêm khung văn bản, bạn cần nhấp và kéo chuột để tạo khung."
1225,2. 创建文字。要使用文字工具添加单行文字，单击任意位置并开始输入文字即可。,"Tạo văn bản. Để thêm dòng văn bản bằng công cụ Text, hãy nhấp vào bất cứ đâu rồi bắt đầu nhập."
1225,- 使用左上角的纯色框选择文字颜色。,- Sử dụng khung màu ở góc trên bên trái để chọn màu cho văn bản.
1225,- 你还可以使用类似于彩色方块的方框来在文字周围添加描边。,- Bạn cũng có thể sử dụng ô vuông màu để thêm đường bao quanh văn bản.
1225,使用这个工具在Adobe Illustrator中选择对象。,Bạn cần sử dụng công cụ này để chọn đối tượng trên Adobe Illustrator.
1225,3. 点击选择工具。它是一个类似于黑色鼠标光标箭头的图标，位于工具栏顶部。,Nhấp vào công cụ Select với biểu tượng con trỏ chuột màu đen nằm đầu thanh công cụ.
1225,使用选择工具来选择文字。,Sử dụng công cụ Select để chọn văn bản.
1225,4. 选择文字。,Chọn văn bản.
1225,图标类似于黑色鼠标光标箭头，位于工具栏左侧。,Công cụ này có biểu tượng con trỏ chuột màu đen và nằm trong thanh công cụ bên trái.
1225,- 使用“字符”旁边的下拉菜单选择字体。,"- Sử dụng trình đơn thả xuống cạnh mục ""Characters"" (Ký tự) để chọn phông chữ."
1225,它在屏幕顶部，位于菜单栏下面。,"Tùy chọn này nằm đầu màn hình, bên dưới thanh trình đơn."
1225,- 使用“字符”旁边的第三个下拉菜单来选择字体大小。,"- Sử dụng trình đơn thả xuống thứ ba nằm cạnh mục ""Characters"" để chọn kích thước phông chữ."
1225,你还可以在下拉菜单框中输入大小数值。,Bạn cũng có thể nhập kích thước điểm vào khung thả xuống.
1225,- 点击屏幕顶部的字符，可以显示更多的字符选项。,- Nhấp vào Characters ở đầu màn hình để hiển thị nhiều tùy chọn hơn.
1225,这个菜单允许你调整行距、字距、行间距、字符间距、垂直比例和水平比例。,"Trình đơn này cho phép bạn điều chỉnh hàng đầu, kerning hay khoảng cách giữa các ký tự, khoảng cách dòng, tỷ lệ dọc và tỷ lệ ngang."
1225,- 使用“段落”旁边带有线条的图标，将文字对齐到左边、右边或中间。,"- Sử dụng các biểu tượng với đường thẳng nằm cạnh mục ""Paragraph"" (Đoạn văn) để căn chỉnh văn bản về bên trái, phải hoặc giữa."
1225,6. 选择文字。,Chọn văn bản.
1225,当你设置好文字外观后，就可以使用工具栏中的“选择工具”来选择文字。,"Sau khi đã hài lòng với hình thái của đối tượng, hãy sử dụng công cụ Select trong thanh công cụ để chọn văn bản."
1225,- 在将文字转换为轮廓之前，你可能需要将它复制并粘贴到画板的一侧。,"- Trước khi chuyển đổi văn bản thành hình phác thảo, bạn nên sao chép và dán đối tượng vào một bên bản vẽ."
1225,作为矢量图，文字可以显示在任何电脑上。即使这些电脑没有安装你所选的字体。,"Dưới dạng đồ họa vector, văn bản sẽ hiển thị trên mọi máy tính cho dù máy tính đó không được cài đặt phông chữ trong bản phác thảo."
1225,8. 点击创建轮廓。,Nhấp vào Create Outlines (Tạo phác thảo).
1225,这样就会将文字转换为矢量图。,Văn bản sẽ được chuyển thành đồ họa vector.
1225,- 如果字体有描边，你需要使用方法1中的步骤来创建描边轮廓。,"- Nếu phông chữ có khung viền, bạn cần áp dụng các bước trong phương pháp 1 để tạo phác thảo cho đường bao."
1226,7. 重复第5步。再把针从第一个扣孔穿过，拉紧线。,Lặp lại thao tác. Đâm kim lên qua lỗ đầu tiên một lần nữa và kéo hết đoạn chỉ xuyên qua lớp vải.
1226,8. 固定扣子。,8. Đơm chặt nút.
1226,9. 缝到最后一针的时候，在布上缝一针，注意不要穿过扣孔。,"9. Đến mũi may cuối cùng, bạn sẽ đâm kim qua lớp vải, nhưng không kéo qua lỗ trên nút."
1226,把线在扣子和布之间绕6次，这样可以防止固定扣子的线磨损脱落。,Quấn chỉ. Quấn chỉ 6 lần quanh đoạn chỉ đơm giữa nút và vải để giữ chặt nút.
1226,1. 选好工具。,Chọn vật liệu.
1226,无论你用的是双股线还是单股线，要留出一段很长的线以便缝扣子。,Lấy một đoạn chỉ dài bất kể bạn dùng chỉ đơn hay chỉ đôi để đơm nút.
1226,7. 把针从对角的扣孔穿过布，拉紧线。,7. Đưa kim xuống lỗ đối diện và đâm xuyên qua vải. Kéo căng đoạn chỉ.
1226,10. 缝到最后一针的时候，在布上缝一针，注意不要穿过扣孔。,"10. Đến mũi may cuối cùng, bạn sẽ đâm kim qua lớp vải, nhưng không kéo qua lỗ trên nút."
1228,关于生日话题的词汇还有很多可以用到，下面是关于用日语祝生日快乐的一些知识。,"Ngoài ra, còn một số từ vựng liên quan đến sinh nhật có thể sẽ rất hữu ích với bạn. Dưới đây là một số thông tin quan trọng liên quan đến lời chúc mừng sinh nhật ở đất nước Nhật Bản."
1228,祝你生日快乐,Chúc mừng sinh nhật
1228,- 这种说法仅限于熟悉的朋友或是那些你可以对其说话随意的人，一般来说，包括朋友，大多数同学，大多数孩子，和大多数亲兄弟姐妹或堂弟妹。,"- Chỉ sử dụng cách diễn đạt này với người mà bạn đã thân thuộc cũng như có thể nói chuyện suồng sã. Nói chung, bạn có thể nói với bạn bè, hầu hết bạn học, trẻ con, đa số anh chị em ruột cũng như em họ của bạn."
1228,- 请不要将这个句子用于地位比你高的人，如老师、监护人、陌生人或长辈。,"- Tránh sử dụng lối nói này với bất kỳ người nào có địa vị cao hơn bạn, như thầy/cô giáo, người giám sát, người không quen biết hay người lớn tuổi hơn."
1228,- “堂就比”(Tanjoubi)意思是生日。,- Tanjoubi có nghĩa là “sinh nhật”.
1228,- “哦咩贴哆”(Omedetou)意思是祝贺。,- Omedetou có nghĩa là “chúc mừng”.
1228,这个句子更正式，可以用于礼貌用于或是极其真诚的生日祝福中。,"Câu này mang tính trang trọng hơn và có thể được dùng như một cách nói chúc mừng sinh nhật lịch sự, chân thành."
1228,- “哦咩贴哆”(Omedetou)意思是祝贺，对熟悉的朋友、社会地位与你相平或比你低的人用这一表达，包括朋友，同学，小孩儿等。,"- Omedetou có nghĩa là “chúc mừng"". Sử dụng mẫu câu tối giản này với những người mà bạn quen thuộc hay có địa vị xã hội tương đồng hoặc thấp hơn. Chẳng hạn như bạn bè, bạn học và trẻ nhỏ."
1228,- “个杂伊吗斯”(Gozaimasu)是强调正式程度以及真诚度的一个词，所以“哦咩贴哆 个杂伊吗斯”(omedetou gozaimasu )适用于长辈、老师、监护人、以及任何社会地位比你高的人。,"- Gozaimasu là một cách nhấn mạnh tính trang trọng hay chân thành, omedetou gozaimasu phù hợp để dùng với người lớn tuổi hơn, thầy/cô giáo, người giám sát và bất kỳ ai có địa vị xã hội cao hơn."
1229,煮沸或蒸发等天然方法适用于少量的水。,Các phương pháp tự nhiên như đun sôi hoặc cho nước bay hơi sẽ hữu ích khi bạn xử lý một lượng nước nhỏ.
1229,不过，为大量水脱氯时，你可能需要用到添加剂。,"Tuy nhiên, với lượng nước lớn, bạn sẽ cần phải dùng hóa chất khử clo."
1229,氯具有挥发性，在开放的池塘中会自然散发，但是增氧会大大地加快这一过程。[1] 研究来源,"Clo là chất dễ bay hơi và sẽ tan tự nhiên trong hồ nước hở, nhưng vòi phun sẽ đẩy nhanh quá trình này một cách đáng kể.[1] Nguồn nghiên cứu"
1229,1. 为鱼塘安装增氧喷头。,Lắp đặt vòi phun cho hồ cá.
